rank,Tweet
0.0004170945688828159,  so badSlash prices or send them to refugee camps like team gear after they lose championships 
0.0004169387618151436, u know ion play that shit bout my weary brother
0.00041687270573063386,When anger rises think of the consequences quote wisdom 
0.0004168262130262806, dreadful day at work n now im gonna be late for class n im covered in paint n now i have to work a night shift too 
0.00041677772276330874,PeopleLikeMeBecause    People are using this hashtag to brag about themselves  I'm not interested in pleasing others but in pleasing God
0.0004166521170241616,The Quarterback' wrecks me every time 
0.00041662819999975346, John Kerry fckd uchief justiceofpak made the statement publicly about party supporting terror what else u needterrorstatepak
0.0004166145524766839, I admittedly went into this series thinking we'd see the Jedi in their heyday not as dysfunctional UN Peacekeepers in space
0.00041660546905900617, data stolen in and only now do you tell us shocking
0.0004165293902652337,After terror our leaders say 'Don't jump to conclusions' but in matters of racial unrest they are silent Why is that 
0.0004165110412744224, stop the presses  saidproposed something racist 
0.0004164975341046078,Stop tracking back you fucking potato faced cunt errrr infuriating   _emoj_angry_   _emoj_angry_   _emoj_angry_   _emoj_angry_   _emoj_angry_  angry Rooney mufc
0.0004163381123985346,   I rejoice everything time some moron is taken out of the genetics pool
0.0004162075354324678, Good  cuz that's what Trump is a fucken 'N'azi Don Kingu havnt sunk this low since u set up Mike Tyson pathetic Dons
0.000416184377587013,if u have time open a snap u have time respond
0.00041608017848236836,the girl sitting in front of me is chewing her gum like a cow amp im ready to snap   _emoj_hugging_face_
0.00041605094508641153,Chart music is pretty much ALL the same horrific
0.0004159717896047658,Where's your outrage when a black man kills another black man in the streets
0.00041584958571919025, should have stopped after 'smiled' Being rudenot the same as being funnyIt was just being mean  stoppickingonwomen
0.00041575134723013664,the bee sting still suck i feel sick
0.0004157356254898469, we about to get shit on by the wrath of winter out of nowhere
0.0004157255278855859,  BTW George W Bush left office in We have had terrific leadership under Barack Obama Keep America Great
0.000415659047060748, he might donate the money but it won't stop shit pessimist
0.0004156074336835299,    Doubt U have anything to be afraid of as Trump has been vilifying minorities amp women
0.0004156073118174494,   i do not offend your Faith unless persecutes me treat me like a dog disrespect me and even so
0.0004154486794211886, always unhappy and easily offended
0.0004152922736018578,I freaking hate working with word on my phone  write writing writerslife writerproblems writer
0.0004152659681634934, why does tracking show my equipment delivered when it wasn't Why is my service suddenly delayed We've already weeks fuming
0.00041512909541343695,In other news My legs hurt running 5kin26mins dreadful flatfeet
0.0004151140570642939,I'm sorry but since when is an indiegames DLC worth nearly xa3130 that's just plain lunacy when the game itself is xa320odd astounded   _emoj_scream_ 
0.00041498192828647273, in the same speech  However he did mention foreign hand and funding in terrorism in the country   _emoj_thumbsup_  ProudOfYouPrimeMinister
0.00041493604893880985,Have the producers of  ever been outside of their country These are universal problems worldwide 
0.00041490625995891967, this is sadly what my history teacher talked about why the fuck do I remember that
0.0004148368794529433, Oh you insult me What you think just because I look like this I'm psycho I'm more sane than most Gotham freaks
0.0004146446565667473,says who are you to compared me with the others I'm just human lit fire burning
0.0004146182752552843,I'm tired of everybody telling me to chill out and everythings ok no the fuck its not I'm tired of faking a a fucking smile
0.0004144538341951195,hitting your children as discipline because you're being quite a raging hypocrite if you're not
0.0004144147103556808, black armed thug with a record carrying gun illegally gets shot by black cop outrage   This is a jokeLet em destroy their town
0.0004143635252935111, just received order from  amp the chips are under cooked amp half raw Usually best part of the meal notcool terrible
0.0004142852963005173,Oh that cheery fucking note good night shit heads X
0.0004142693424684954,Michelle is one of the worst players in bb history bb18 bbfinale bitter
0.0004140822382089292,    Fucker blocked me years ago over a question lol  proper holds a grudge old Joe
0.00041399785435964226, This is it The complete illiteracy around the role nature and extent of British agents is shocking
0.0004139866339433209,Take public opinion on revenge with Pakistan if govt is unable to decide   
0.00041398572037885055,The war is right outside your door rage USAToday
0.0004139524954375208,What a shamefull unequal dangerous and worrying world we live in nowadays  terrifying Charlotte terrorism shitworldforourkids
0.00041384492244450605, Annoys me to about the Ortiz tribute too how would the Oriole fans and organization feel if Yanks did that to them awful
0.0004138165430098187,Like I can't do hours worth of standing or calorie burning in hours   _emoj_sob_   _emoj_sob_   _emoj_sob_   _emoj_sob_  1stworldprobs4vs
0.00041380440443405323,not to be That Person u2122 but i get bitter seeing some ravi stans
0.0004137472567579655,And getting offended or furious that a writers style isnt to your taste is ultimately daft I suppose
0.0004135534138318685, Virtually every statement by other countries at UN has referred to terror as main threat to peace Pak still in denial
0.0004134815688515376,A MOMENT If you kill it in the spirit it will die in the natural' murder suicide  racism pride
0.0004133839510330887,Headed to MDW w layover in SLC Got off for food Wrong move Bailed on my food amp barely made it  WannaGetAway Contest 
0.0004131956728643476,Damnnit Gonna be pts shy on Chiefs Rewards of getting a post game photo
0.0004131510239572764,When anger rises think of the consequences quote wisdom anger
0.0004130221740125497, lol DK has actually dropped from top of the table surprisingly Arms Warrior is top of the DPS at the moment shocking
0.0004128928090899279,They gonna give this KKk police bitch the minimum sentencejust wattch angry
0.00041275670015479196,When a guy comes on the train that smells like a mixture of a damp dog old sweat and sewage works gross  getoffthetrain smelly
0.0004127213908835992,    Even the painting is orange  terrible Election2016
0.0004127208098748633,_Her mind is a dark room Developing Madness    _emoj_hot_springs_   _emoj_blowing_kiss_ 
0.00041268164873826355, you charge extra for sending someone out and your cable service still doesn't work That's robbery cable  service
0.00041267347769697585,weeks into the course and have had the kitchen sink thrown at me I m still pulling knives and forks out of my ears
0.00041265855148188337, you're sadly mistaken if you think I'd make a tweet for an isolated comment by a random twitter user
0.000412648519675105,And it pisses me off more they killed people who surrendered Hands up and all If hands visible you shouldn't be fearing for your life
0.00041231903157921615,if we let that in id be fuming poor keeping
0.0004121863665782147,I'm much to full of resentment
0.0004121529227548632,Another loss to city in the cup next   _emoj_see_no_evil_    _emoj_joy_   _emoj_joy_  cmon united revenge
0.00041209256428775636,Wanted to get him a cake with sparkling candles but he doesn't like cake  _emoj_unamused_   _emoj_unamused_   Ruins everything
0.00041199604717142587,Yal aggravate tf outta me acting lying yal can't tell the difference between a dyke and a man RARELY is it that hard to tell the difference
0.00041178910219857303,Houston might lose a coach tomorrow or by midnight  yikes offense
0.00041169541928071313,Defining yourself in terms of opposition ie the clouded mirror phenomena is almost always a mistake
0.0004116511110425551, why does tracking show my equipment delivered when it wasn't Why is my service suddenly delayed We've already weeks 
0.0004116249570832943,    summar one more insult from you and you're gone Idc if you're my dad
0.0004115765964826415, don't know I'm from nj we are the worst on purpose 
0.00041152089036060454,And the character is a woman Because if a man is fat he's jovial If a woman is fat she's useless and maybe evil amirite
0.0004115108434509787,  Yep as I pointed out before it's the politics of loathing That's why the big candidates are so horrible
0.00041123154602329377,Dear future big brother players just chase dick all season and you too can win dollars and an Sti bb18 
0.0004111683788771989, literally Nicole already had her chance and she played shitty both seasons bitter
0.0004110415145934051, Your ass looks horrible Oh is that your face
0.00041102397599434675,I have a rage rage ep coming out soon I'll keep you posted on it YouTube youtubegaming rage
0.0004109032450179164,I don't get what point is made when reporting on Charlotte looting  Why not explore what looting businesses symbolizes outrage
0.0004107066425359567,Gosh anxiety attacks turning into Panic attacks are fucking ugly 
0.00041068881083009136,  The problem is that right wing extremist terror groups aren't given coverage press not interested
0.000410578991139112,In my room would go  Russell HowardTom OdellMichael Buble pants nogood 
0.00041057699508413326, lol wow i was gonna say really haha have you seen chris or nah you dont even snap me anymore dude
0.0004105705130664256, holy shitwhat the hell happened to your lips Fix that shit mtv teenmom horrible
0.0004105701636452438, she's pathetic Hated Nicole for being cute amp having a showmance amp she couldn't get one bitter uglycry BBMichelle   _emoj_confounded_ 
0.00041056960513733977,  unarmed blacks killed by white cops in That many die every month in Chicago wheres the 
0.0004104282709142554,my husband lost xa3800 when he booked an apartment through  that didn't exist  didn't care nightmare airbnbnightmare
0.00041027359446365447, just finally started homefronttherevolution what did you all do the story and gameplay terrible wasteofmoney
0.0004102001419863088, going back to blissful ignorance fury
0.00041010550825376364,   The way my blood is boiling little bastards
0.00041004372395082205,A not very young man compiled info on a smiling baby then a mattress created new evil
0.00041003659982734075,PeopleLikeMeBecause of some unknown reason but I try to discourage it
0.00040990627534677167,Why is it when you nap during the day you are so comfortable but sleeping at night you'll never be as comfortable 
0.00040980502196481426, how can you even forget to pick ur fave child up from school offended
0.0004097782368991518, wakes up and says 'have you tried changing her nappy'   _emoj_rage_   _emoj_facepunch_   _emoj_fitzpatrick_type_3 
0.00040969136512978004,This weather got me fucked up Like you either be sunny and hot or gloomy and cold No in between
0.00040966967547041374,Trying to book holiday flights on  website is becoming a nightmare
0.00040953381617577964,    Well I'm too old and too stubborn about facts amp history to be discouraged
0.0004094826998084832,  Despite your outrage fatigue don't lose your shine
0.0004093802320721724, business class Los Angeles to Dublin destroyed luggage day customer response time unhappy customer
0.00040935617614284287,In Bangladesh war US almost bombed us had Russia not been there What strategy for China on Pakistan Time ripe to crush terror camps
0.0004088664300359148,At UNGA Pakistan clearly shows the face of cowardliness and blatant lies Its time for India to act upon terror
0.0004088635881842062,   Anychance of addressing the communication I sent to you yesterday I still haven't had any contact shocking
0.0004087925695948812,savemoney and savelifes  your openbar  weddingreception Close it hours early forcing your guests to sober up before driving
0.000408759016994817, going back to blissful ignorance 
0.00040875899037598034,  Great defender terrible positioning Didn't know where he should be without Russel shouting at him for mins
0.00040870999775052596, Harwood gleeful at these new numbers bet your money on this reportinglook to lose it liarthiefscoundrel
0.00040869575400006935,THIS BOOK IS FRICKING INSANE LIKE HOLY CRAP panic
0.0004084873526889525, just came of BA6426 at  at least passengers with broken bags This was a new suitcase unhappy customer
0.00040843483832010653,How in the world did Nicole beat Paul terrible bb18 BBFinale What was the jury thinking   _emoj_flushed_   _emoj_flushed_   _emoj_flushed_ 
0.0004083564699897075,Eat my ass' is no longer an insult
0.0004081139417640337,I got a NO RESPONSE again from an irate customer of amazon   _emoj_disappointed_   _emoj_disappointed_  why can't they understand that it's not always amazon fault carrierfault
0.0004080346479276646, Only Indian seems to be afraid of War is  n like India is for WAR WAR WAR we cry war PakistanMustPay
0.00040766462400261945,  yes it's shocking how islamophobic Indias are considering how many Muslims live there
0.00040748701392440487,  her team must draw from a hat for daily personality drugged  yeller quiet screamer   _emoj_joy_   _emoj_joy_ 
0.0004074741167470236, yea because forcing turnovers and holding a pretty good offense to points is concerningoh wait NO
0.00040740357762653577,There's a certain hilarity in people angry at protests against the national anthem or the flag when these acts are covered by 1st Amendment
0.00040728623378826195, Madrid is playing awful and no modric but minutes in Bernabxe9u stadium are so so long Viallreal never won there
0.00040719729154614577,Yall rlly gotta stop lettin bees put fear in ur heart unless ur allergic I'm not tryna see u run around from a fuckin beechill u soft
0.00040713982163574153,  I remember TAs in the gamedev program said he had temper tantrums in class all the time lol
0.0004070960966680076, And I hope when the police met him at the subway that they took him straight to jail   _emoj_confused_  
0.00040707678473152567, That was exhilarating hockey They're still out if Russia wins in regulation I'm reading fuck
0.0004069989523910261, A profoundly disappointing experience I have pay almost remedy a defect n the product  sold me 
0.00040699459934908245,I dislike people who get offended by the littlest shit 
0.0004069090143966078,The best revenge is massive success
0.00040689607173662675, I dont have to sit here and take this from u spry young children
0.0004068260477491234, I did that days later my order isn't even in the same postcode as me 
0.00040665985913584496,Am I the only person who dislikes fall FirstDayofFall leaves thingsdie depressing cold noflipflops   _emoj_1_   _emoj_fitzpatrick_type_5_  _emoj_1_   _emoj_fitzpatrick_type_4_  _emoj_1_   _emoj_fitzpatrick_type_1_2_  _emoj_fallen_leaf_   _emoj_maple_leaf_ 
0.00040645064353488026,Appropriate that first secretary at permanent mission is tasked with demolition of terror state Pakistan  Like 'renunciation of lies' bit
0.0004062221153347451,my mom cut my phone off and I'm so furious   _emoj_hugging_face_
0.00040605581503268544,  im now writing abt the changing face of sex industry in tr  now men will talk to me then 
0.0004059000684120992,Have wee pop socks on and they KEEP FALLING OFF INSIDE MY SHOES rage
0.00040579098670407164,Circle K is dead to me I hate your new slushie machine irate livid
0.000405782879937832, how do u guys determine teams Cause I'm on shitty teams when I play and I'm fuckin over it cod rage
0.0004056599590117419,Asian Tiger Mosquitoes are so relentless More aggressive than the kind I dealt was a kid
0.0004055027035478693,Circle K is dead to me I hate your new slushie machine  livid
0.0004055019018912503,Bain of my life having to drive to a cash point Then to a shop for change in pound coins Then to the gym all for a bastard sunbed grim
0.0004054565974333843,One more day tiff One more day
0.00040535233485990276,Southend players always haunt Man U
0.0004052882992456435,Time for some despair SDR3  fuckthisanime
0.0004052424457425168,I get so much PUSSY P  panic attacks  U  uncontrollable anxiety  S  suicidal fantasies  S  sadness  Y  yearning for death
0.0004052306836456914,With that draw the scum must be rubbing their hands with glee Typical draw for the Woolwich lot jammygunnerscum
0.0004051650015264043, why dont blm thugs want justice when its black on black gang crime They only rage and cry racism when its a cop
0.00040510825723095593, why you gotta use the dark skin emoji offended
0.000405053664802415,Hell hath no fury like a sound technician scorned'  That's the quote right
0.00040493170656811595,LGBTQ media should inform inspire entertain ampunite our community It shouldn't give platform those whose goal is offend us attention
0.0004048966482013851,not only was that the worst  that's I've attended but worth one of the worst cons I've been to in the last years 
0.00040485511941584974,whenever I put 'I wanna be adored' on my brother alwayss sings 'I wanna be a dog' instead just to irritate me
0.00040485270049166715,Sometimes The Worst Place You Can Be Is In Your Own Head'  quotes worstenemy depression thinktoomuch
0.0004048268356969319, I did that days later my order isn't even in the same postcode as me fuming
0.0004047400771187999, spent over fucking hours and still can't get that dam SIVA fragment on Fellwinters peak mountain angry
0.0004046308675191368,  Very rare an officer just shoots without regard They don't want that on their conscience incite inflame
0.00040461280844388036,Need a new outlet for rage
0.00040459669619141166,there are magpies gathering around me help I'm going to be swooped  terrorism
0.0004045415431627826,How could such a crookedstuck updelusionaldimamp dark hearted dud be surprised losingampprob also ppl won't let their crimes drop nwo imo
0.00040449657525451217, it's very telling that racist bigots always resort to the insult 'fag' like that's worse than being a racist bigot
0.00040447799930785693,My irritation level is at an all time high today   _emoj_upside_down_face_
0.00040445580854196734,What a shamefull unequal dangerous and worrying world we live in nowadays terrifying Charlotte  shitworldforourkids
0.00040432043957262163,But what will complaining pessimism regret and anger get you
0.0004043094958269863, We've had no foreign policy but have had goofy Secretary of State John Kerry with his devil may care pose and jaunty blue scarf
0.0004042373645153859,my haters are like crickets they chirp all day but when I walk past them they shut the fuck up  my idol
0.0004040218947929436,Anytime  gets near a mic someone needs to smack him w a bat   marblesinmouth
0.00040399845418103905, i have unsubscribed times from your spam emails still coming STOP THE EMAILS avanquest software terrible
0.0004038476016635367, You're doing a terrible job exemplifying the values you espouse Yesterday you lamented losing a generation of voters
0.00040372478063713507,Who allowed Pereira to start taking all the set pieces fuming
0.00040370497271889784,That defending was awful from us
0.0004036809557503347,terror attacks in usa pay no mind lol
0.00040346285530041794,Get to work and there's a fire drill fire  outthere inthedark
0.00040338670973469,Did we miss the fact that BurkeRamsey swung amphit his sister JonBenet in the face with a golf club previously out of a fit of 
0.0004033535526498863,Is it me or is Ding wearing the look of a man who's just found his arch enemy in bed with his missus angryman 
0.00040328043183127506,Since the 'update' my  loses power nearly faster  furious
0.00040316859947647803,  The solution is to punish the criminals That's the only way to discourage crime or the circle will continue
0.00040311331030612463,    THEN you do what you can and then BLOCK them they're trying to discourage us
0.00040307272199156623,I wonder what American city will be next to protest about police shootings Who's next Smh whenwillitstop  howmanymoretimes
0.00040295825967042587,What did y'all do to your app    It's horrible  horrible  Worst except once ever
0.00040287679916098726,  Amal Clooney should try to prosecute  Bush Blair for war crimes that turned our World upside downampcreated 
0.00040285197635066316, FMF protesters aren't interested in reasoned debate just intimidation violence amp disruption to get demands met
0.00040258971379841,I just poured boiling water on my foot now my cup of tea is less enjoyable but worse my football career is foiled
0.0004025712110392269,World is facing terrorism Where Terrorist's school exist Who are terrorist's teacher amp father Which is terrorist's motherland
0.00040253225867826163,Theyve substituted the hood for a badge and gun' Public opinion is indictment of Charlotte police dark sadtimes america race
0.00040239136320115203,Marcus Rojo is the worst player i have ever seen Useless toasting burning bastard
0.0004022815107842456,In other news My legs hurt running 5kin26mins  flatfeet
0.0004021831923565908,Id love c Gyimah in action but his coach is holding a grudge against him
0.00040215298889775564,    I thought it was because she once sunk her teeth into something that's meant 2b sooked
0.0004020277511948426,    I dread to think DirtyPeople
0.00040194160177121625, should have stopped after 'smiled' Being rudenot the same as being funnyIt was just being mean bully  stoppickingonwomen
0.00040170392740146183, can you maybe break it down into smaller bits or space it out so it doesnt seem to daunting
0.0004015989850827166, No  By Y'all I mean rioting fire starting business burning looting ASSHOLES  That create  BlackLivesmatter terrorism
0.0004015021611655691,When your sister is and throws legitimate temper tantrums just to get attention
0.0004014363745977935,why the fuck does my mum want me to put corn in the curry grim
0.0004014124686529143, I'm about to fly into a fit of rage it's not FAIR
0.0004008484869306411, thanks for getting back to me exemplary customer service for a loyal customer jk awful residentadvisor poorservice
0.0004007875508420721,WHY TF DO BROKE BOYS KEEP TRYNA FIND GF's GET UR FUCKIN  RIGHT B4 I SMACK YO BITCHASS she deserves 2be happy amp u don't deserve that ass
0.0004007782838497685, looking forward to div next year  revenge leictershireaway therey
0.0004005547582194813,Itching something serious RN haven't slept but considering taking like Benadryl for a min nap I am itching SO BADLY wow
0.00040052902226036944,I don't get what point is made when reporting on Charlotte looting  Why not explore what looting businesses symbolizes 
0.000400469913451564,  not as sad as the White Sox playing record 
0.00040045938504627593,Taurus will react angrily when she can't take being provoked any longer
0.00040037924894834796,  is a bully worse than hitler a demon under human guise its the cause of all MiddleEast problems
0.00040036803405824777,Ghanaians don't need to wear black to mourn tho They can just walk naked dodges stones Na joke na  _emoj_white_frowning_face_  '
0.0004002626008215002,As if he heard my thought on the ether my ex has just posted facebook pic of himself snuggling up with said cats now Im just angry
0.0004002459431459472,Why is it always me picking up the pieces  
0.00040023323340411516,    also celebrate THEIR belief that Jesus is alive in hell boiling in a pot of shit actual shit
0.00040006205659627375, Giroud's beard is making me angry
0.0004000155311960941,My life is going downhill at an alarming rate
0.00039990885732567555,I've been wanting salty fries from McDonald's since yesterday and I'm burning my fingers eating them bc these shits   _emoj_fire_   _emoj_fire_   _emoj_fire_ 
0.00039990355638881936,Now they fret about scuffs I'll take scuffs which u2026come in for a phone I can use wet handed or drop in a toilet any day
0.00039989474768984496,Should I give the windy tiger those ankle and wrist tapes I didn't include any characterspecific details in the burning fox so
0.0003997911094105416, blacks are good at provoke them selfs blaming on white when black cops shooting blacks
0.0003997637597521915,No red card for Gordon there The ref must be a Celtic fan as that was a shocking challenge
0.000399726360228416,Why does terrorism exist in the first place AskTrumpOneQuestion
0.00039971705519431126,Paul forever Paul should have won Paul played such a better game BB18 angry
0.00039969115903864237,So unbelievably discouraged with music as of late Incredibly behind on Completing my album Not digging this at all
0.00039962920037899414,Good luck to all FuryHaney players playing this weekend at the Future Stars showcase in Frisco Tx  KGB Gtown fury
0.0003996209954875017,Worst juror ever Michelle You were Nicole's biggest threat bitter bb18
0.000399602918885484,new madden video was gonna be up but xbox is being an ahole and not going through   _emoj_face_with_rolling_eyes_  _emoj_face_with_rolling_eyes_ struggles
0.0003994239188931508, holy shitwhat the hell happened to your lips Fix that shit mtv teenmom 
0.0003993236421363104,Skipping meals is the national way of showing disappointment and  wiz
0.00039919020652936274,What u do wen ur love cheats on u  Wen thy don't understand the emotions behind the anger the constant waiting what u do  
0.00039916295212100107,Editing a father of the bride speech At minutes in she tells him to wrap it up He goes on for more minutes 
0.00039915138103176055,Trying to book holiday flights on  website is becoming a 
0.00039913771688241355,im literally shaking bc im nervous and bc its fucking cold oh how i love life
0.0003991129357977556, u shd b embrrssd u jack up my bp meds twice and it will still take days Not express at all expressscripts 
