rank,Tweet
0.00037832043668189526,a vote for killary is like sticking a knife in a toaster shocking MakeAmericaGreatAgain
0.00037822168644903345,The animosity toward Hillary comes from conspiracy theories and perception the animosity toward Trump is based on what he says and does
0.00037820621227789396,Trump supports reach another level of irritation within me
0.00037820511383383597,The best revenge is massive success   _emoj_en_dash_ Frank Sinatra
0.0003781996219455457,Aleppo city is burning The head of terrorism Assad regime amp Russia are bombarding the city right now with whitephosphrus bombs 
0.00037811197970350055,Drunk people annoy me when I'm sober lol  fact TeamFollowBack RockTheReTweet
0.0003780501192305188,Aidy has a physics question Aidy ' ok I'm not gonna ask Tristan cause I don't wanna aggravate her'
0.0003778785876436227,    everyone is against wigan because we are the biggest club bitter
0.00037772899987882186, honestly All I care about is Selasi not messing this up His lackadaisical attitude isn't good for danishes
0.0003776927506322334,My soul is weary of fighting the battles in this world BlackInAmerica WeAreNotSafe
0.0003776670843067837,Why are people that don't have iPhones so bitter about iPhones Can someone explain
0.00037762804613247726,    Have you give thought to Khalistaan  No concern of you Baluchistan  Kashmir is an Issue
0.00037722202710610076,They want as police state they are fearful imbeciles   
0.0003772160321191262, VoteYourConscience or succumb to fear 'He is scary he is dangerous' 's alarmist PATRIOTACT platform
0.0003772070345265232,  as CEO of a charity you could reasonably expect  not to attempt to crudely inflame tensions
0.00037717747967161886,All with weary task fordone Now the wasted brands do glow Whilst the scritchowl scritching loud AMNDBots
0.0003771454876518415, specifically are the cause of it all and they resent being considered the enemy
0.00037697442098977296,I'm done with your piano blues playing smooth talking ass On to the nexttt
0.0003769404618439905,They gonna give this KKk police bitch the minimum sentencejust wattch 
0.0003768697808625809,internationaldayofpeace  When white supremacists terrorize everyone of differing cultures online and will continue it offline tomorrow
0.0003765466250220344,i wonder how gleeful it is to be dumb af and see the world through rose tinted glasses
0.0003765287270467329,When your body says FUCK YOU BITCH You ain't sleeping sleep cantsleep drained restless
0.00037648676087409684,How was Natalie one of the top three favorites toofaced and bitter   _emoj_face_with_rolling_eyes_
0.00037627066243300667,I just killed a spider so big it sprayed spider guts on me like a horror movie ugh revenge
0.00037625927313046106,Chick told me I look like Childish Gambino insult or compliment
0.0003761701703842813, Mustard gas  hostile work environment not terrorism call OSHA not military
0.00037593094718241146, unhappy with redbus CC when I talked with them before a week still they didn't initiate the refund of the transaction
0.00037575980242139146,My name is John Locke and you can't tell me what I can and can't do lost  u30a2 u30cb u30e1
0.00037569401780326834,Absolutely raging at the changes to CAS what a joke
0.00037554379736306917,Honestly there are some awful people on the internet smh
0.00037538315208518523,   I agree but our offense was ass after the second half td score on the first drive
0.00037529605163497305,I had Golden Ocean the other day it was lush then I gagged and was sick What a waste of xa320  I was fuming  I miss you
0.00037517559793652993,  Isn't OBrien supposed to be some sort of offensive genius awful
0.0003751010127474443,If you ain't shaking no ass don't ask me for my liquor Rule
0.00037507863521271114, I remember Joey slagging England player's off bringing out books after crap tournamentssame samecrap player 
0.00037493620402683273,White people irritate me
0.0003749031143715253, never bring back Meech and Bridgette Crying because someone looks at you Ugh and Bridgette bitter
0.00037478691943177155,For every minute you are angry you lose sixty seconds of happiness  Ralph Waldo Emerson quote
0.0003747345858493441,  Stephen King never once spoke out about how the Left crushes FreeSpeech in publishing world   Trump  scifi ccot p2
0.0003747187630580918,  Irish citizens boiling drinking water in leaves one foot firmly in the bog
0.0003746699993486811,Damn our offense is a mix bag of unpredictable lethal weapons I'm worried for Defense Coordinators   _emoj_grin_  Chargers Boltup Recharged
0.0003746380814786937, stuck on runway after being diverted to Fargo Continuously told just more mins for the past hours No foodwater offered awful
0.00037460873397588134, that's what I'm afraid of
0.0003745863815271112,GahhBT in queue for minutes Now put through to BT Sport dept to cancel back in a queue again shocking
0.0003745446619343773,The underground at Waterloo is not a nice place to be at 830am on a Thursday somanypeople grim
0.0003744975490688326,If you let a general tweet offend you you definitely shouldn't be on twitter
0.0003744272177713779, NO The gay guy and the dad revenge fucking
0.0003744243855996917,My cat is bloody lucky the RSPCA weren't open at 3am last night fuming   _emoj_rage_   _emoj_cat_ 
0.0003741403754004894,I'm also upset at my incorrect use of a comma grammar struggle hesitation backtoschool   _emoj_school_satchel_   _emoj_books_ 
0.00037401741713034034,  wow My bill is xa34477 and hav a text from u to prove that and you have taken xa3148 swines fuming con
0.0003739731996843436,Point scorning and fury at Labor does nothing to address long term detention and the need to resettle asylumseekers from manus and Nauru
0.0003738797320896923, then it's poor packaging my Amazon and the fulfilled seller should be furious as much as you   _emoj_confused_ 
0.0003738462271689137,I envy ice at least if you give it warmth it melts TaylorLautner Twilight  quote
0.0003737854895583156, since when the fuck can you not stand at a concert raging
0.00037369120513257715,Recommended reading Prisoners of Hate by Aaron Beck anger
0.00037358173456659635,Inpouring this letter we are dying over against subsist checking quaint virtuoso ways toward fine huff yours l
0.0003734924606590409, coincidentally watched Ulzana's Raid last night  brutally indignant filmmaking
0.0003734349716920572,   huh We have a sprint coach We're the slowest team in the comp Talk about robbing a living outrage
0.00037338959967510174, against Chelsea anything is possible haha I'm fuming about that bet   _emoj_face_with_rolling_eyes_  _emoj_face_with_rolling_eyes_  _emoj_face_with_rolling_eyes_  _emoj_face_with_rolling_eyes_  _emoj_face_with_rolling_eyes_  _emoj_face_with_rolling_eyes_
0.00037324569209166384,  i have hit a lot of irate villa fans lol
0.00037323429776269786,The majority of people irritate the fuck out of me cba with people ahahah
0.00037322621039900615, there was a US diver named steele johnson i'd like him barred from the olympics 
0.0003731581797482232, i Lowkey forgot you had twitter and if you don't follow me back im gonna be offended
0.0003731427437973494, EA sports technical support team really suprised me   _emoj_blush_  SUPRISED ME AT HOW SHIT THEY WERE awful
0.0003728825147246316,  IT'S GAME DAY      T MINUS  relentless
0.00037280724646750115,  Yeah it was sooo horrific I needed to sit down
0.0003727714116833408,     terrorist attack and terrorism already exists in the history of islam
0.00037270050870431604,mirana told me to shut up when i was singing along to glee
0.00037267265330691464, spent over fucking hours and still can't get that dam SIVA fragment on Fellwinters peak mountain 
0.00037263852408643414,burning the last of 
0.0003725876459794687, RIP Paul furious can't wait
0.00037256775618397137,Dear  please tell your bus drivers if obstruction on their side DON'T just pull out to oncoming traffic causing vehs to swerve fuming   _emoj_rage_ 
0.00037253670427406764,Height of irritation when a person makes a hilarious chusssss Plz die  _emoj_grimacing_   _emoj_grimacing_ 
0.00037250313525254814,I hate it when im singing and some idiot thinks they can just join in with me likethis is not fcking glee MeanRikonaBot
0.00037243258337597303,All hell is breaking loose in Charlotte CharlotteProtest anger looting
0.00037235640896395337,Biggest THREAT GLOBAL STABILITY climatechange food water security terrorism russia war trump clinton geopolitics korea vwo
0.00037205275238958336, which onethe one where u threaten violence Or the phedophiliac u support  Or the constitution violations he proposes
0.0003720302793626157, happy anger sad melancholy confusion woodspurge
0.0003720233275594962,Everyone is raging
0.0003718902009867975, but your pussy was weak from what I heard so stfu up to me bitch  You got to threaten him that your pregnant 
0.00037175046172186366, yes Hun Avoid at all costs 
0.0003717119813195979,I hate freaking out and ruining things 
0.00037162003002800105,Unruly kids at 8am in the morning nothanks ripping the flower beds up by the roots while their parents watch 
0.00037152720694173525,Yeah no I don' mind tweetin' that twice snap blm likeThat
0.00037125762886770276,I got fever highs I got boiling blood
0.00037122870376696525, I love Lizzy Warren's latest rage against Wall Street
0.0003711097548362624,  Its okay to be trans just rejoice with the trans in the trans way By the way it's not your business so why care
0.00037101942890344753, i have unsubscribed times from your spam emails still coming STOP THE EMAILS avanquest software 
0.00037072472758173494,I wouldn't have anger issuesif she didn't have lying issuesthink about that one pow lies confusion
0.0003707050944685625,ESPN just assumed I wanted their free magazines 
0.0003706874617329217,As if he heard my thought on the ether my ex has just posted facebook pic of himself snuggling up with said cats now Im just 
0.00037066111105567187,  frustration looking up at Elphaba in a frown of aggravation Her high pitched voice was growing more and more 
0.00037044424782691973,Swear all of my guy friends are scaredy cats You don't do horror movies You don't do haunted houses Wtf do you do then
0.0003703616723573249,Prayers amp Protection to our brothers and sisters fighting in Charlotte rage against machines
0.0003703322946269262,Bitch worry about me more than I worry about myself   _emoj_face_with_rolling_eyes_  _emoj_weary_ 
0.0003703255423305447,   Didn't Florida teach you anything I live here in Palm Beach County and lived through that nightmare
0.00036995312931155535,days onnever a fucking pen nffc bitter
0.00036989531925615495,Now that the n word is normalized by the media Just wow No words for this  No Words For  This Frog been boiling in the pot via media
0.00036978410761137983, Canada should be a driving force of democracy freedom rights  instead we help dictator misogyny Sharia Islam terror polygamy
0.0003694600112324534,Still can't log into my fucking SnapchatSnapchat snap
0.00036935958570283864,Retweeted Dr Rand Paul   Stop fueling a Middle East arms race and worsening an already horrific refugee crisis in Yemen
0.00036933519256288994, tells me my order will ship on Sept arriving by Sept Today is the   _emoj_neutral_face_  lies terrible whereismyfurniture
0.0003690329591344581, thanks for getting back to me exemplary customer service for a loyal customer jk  residentadvisor poorservice
0.0003688696972187216,Omg someone asked them to sit and they reluctantly moved with a huff Biiitttccchhhhhh   _emoj_hocho_ 
0.0003688345313721668,He's seriously so frustrating sometimes  u256fxb0  _emoj_white_square_  xb0 uff09 u256f ufe35  u253b u2501 u253b ugh raging
0.0003687348937558803,Back on my bully
0.00036855014546179705,This pretentious dick in Night Gallery just fucking used a towel to dry off his sink
0.0003684959163563962, Reyes snarled in frustrated anger steel claws flexing dangerously But she uttered those damning words it seems to snap 
0.00036837042406479166,He called me fat so I pushed him into the lockers then he threaten to sue me'   _emoj_joy_ 
0.00036832243141112143, I think just becz u have so much terror in pak nd urself being  a leader u forgot d difference btw a leader nd terrorist 
0.00036830718072017446, I've been disconnected whilst on holiday   _emoj_triumph_  but I don't move house until the 1st October   _emoj_thinking_face_ furious
0.0003679691146346094,  You certainly wouldn't catch me with the multitude ghastly
0.00036787668729210794, why doesn't this account follow me offended
0.00036777473362505753,Yeah I'm hot nigga they say im burning uhhhhh
0.00036775118872447814,lost my day snapchat streak i'm done
0.00036754158415506464,Or when they hmu on snap and I'm like which one are you   _emoj_skull_ 
0.00036739455465533154, Bloody right 
0.00036730655812268633, unfortunately it won't end there followers of whichever candidate isn't elected will throw tantrums No winning this elec
0.0003672751092914423,RE politicallycorrect BS   What if I am offended by your assumption the USA should change because you are a 'visitor' amp don't like it
0.0003669605909505327, both are nonsensical If there's injustice against blacks why add to it by destroying black property It's misdirected anger
0.00036687012126490414, both scrap ll the rage instead
0.00036686564453448104,Shame on you  showing an elephant being hunted and killed shocking
0.00036680638231544407,How the fuk Who the heck moved my fridge should I knock the landlord door angry mad 
0.00036655596877726795, I'm surrounded by those Trump voters You're right it is fucking terrifying redstate despair
0.0003663446992456997,  Classic SHITLIB bullshit Create a horrible problem and then 'discuss' how to solve it What a PIMP
0.00036627105824842143,I am just so bitter today   _emoj_neutral_face_ 
0.0003661616111578668, species cf Don Jr refugeesSkittlesknow he likes his snacksbut even  frown on talking about eating humans lizardscum
0.00036599393621610486,He's seriously so frustrating sometimes  u256fxb0  _emoj_white_square_  xb0 uff09 u256f ufe35  u253b u2501 u253b ugh 
0.00036593316754017117,Wee cunts playing chappy in my street got my shoes on so I can chase and scare the fuck out of them
0.00036591385004027194,Tears and eyes can dry but I won't I'm burning like the wire in a lightbulb
0.00036580485514212043, so this houses will get into my instestines and scare my poop and I'll shit my pants
0.0003657962191631826,I don't know what's worse the new Pizza Hut commercials or the pizza that Pizza Hut makes horrible
0.0003657010918476212, Bk to up top pack midfield Stifle any flair we possess kill any entertainers dull reshuffle predictable slow average
0.00036568999665012104, the pout tips me over the edge I am most definitely AGIN Who the feic bakes with full make up and boots with heels
0.00036556269946275995,  It's no secret personal dislike of Trump amp animosity has always been presentnow magnified with bigotryracism etc
0.00036546220694307514, yeah a terror packed terror supported speech
0.00036539590735097297,We ashamed of being an ally to you Pakistan sacrificed almost civilians by siding you in war on terror 
0.0003653311987439181, opened doors to terrorism and he will pay for it  
0.0003652573893904304, just trying to go home tonight A run on 2nd and and a run on 3rd and That's what champs do sike losers 
0.00036519846153190705, A plus point she won't have to queue for the loos Any more plus points Nope can't think of any shocking sexism
0.00036476534040978106,   entire team from coaches on down played and coached scared from jumpstreet intimidated
0.0003647015940388288, Democrats and their voters have zero tolerance for honesty They associate honesty with anger and hate
0.0003645679448476149,People that smoke cigarettes irritate my soul
0.0003643764157920701,  _emoj_bullet_ Days' He was itching for a fightitching for the exhilaration of battle of almost getting defeated the adrenaline pumping  _emoj_bullet_ 
0.00036423881809892304, just finally started homefronttherevolution what did you all do the story and gameplay  wasteofmoney
0.0003642180217590733,I be trying to not stay playing madden and 2k but its just so addictive   _emoj_sob_   _emoj_sob_ 
0.000364199096495153,How on earth can the projection of all that is good and happy and true in my soul be a poisonous fucking snake patronus adder offended
0.0003641387517989885,People have the right to protest Not to loot amp riot amp terrorize Charlotte Violence amp Anarchy is unacceptable 
0.00036406555744115807,Panpiper playing Big River outside The Bridges in SR1 outrage
0.00036385152118456555,  imagine being this stupid for trying to chirp because of some racist prick
0.00036379564972344343,It's always depressing to sort WordPress plugin recommendations not by 'best' but by 'least offensive in terms of premium features'
0.0003637836015671883, no Tyson fury beat the man who been at top for years Danny Garcia should be above Bradley pacquaio frampton
0.0003636934250114397,Mary Berry  what's the icing on top of your Bakewell tart It looks like horrid Mr Kipling not something Derbyshire would recognise GBBO
0.00036359379530542715,Controlling anger is a sign of those righteous people promised Paradise in the Quran in Surah Al Imran verses reward goodDeed
0.0003635037021639919,TerribleDebateQuestions Madame Secretary isn't it true that Russia is behind all terrorism
0.00036325694330758277, is the android app it designed to be buggy and work sporadically on a fire TV box shocking
0.000363182211888973,So angry I wanna cry  _emoj_cry_   _emoj_cry_   _emoj_cry_ 
0.00036314100054802363, Canada should be a driving force of democracy freedom rights  instead we help dictator misogyny Sharia Islam  polygamy
0.00036310507813952736, World knows Pakistan is an epicentre of terror The pakistan speech in UN has define their agenda
0.00036288900102578994, I had to unfollow he got trolled by trolls His revenge trolling just caused a lot of collateral damage
0.0003627944663558261,I think Paul is what's bitter not the pastry
0.00036279114125000166, a multimillionaire spoiled brat who gets In a self righteous huff bc his friend is Muslim is a non starter bye
0.0003626735318896445, AgreedSo tired of this nonsense  Soros must be elated
0.00036232837580633617,Still salty about that fire alarm at 2am this morning
0.00036226587317044124,  _emoj_weary_   _emoj_weary_   _emoj_weary_   _emoj_weary_  heads melted very tired but can't sleep 
0.00036173001053827944, relentless echo chamber  negative comments with lots of reverb Typical bully behavior
0.00036163499422185323,My study skills are terrible   _emoj_unamused_ 
0.0003613039423042127,I am using twitter as a coping mechanism for raging out at this kid oops
0.0003608393897946344,and apparently he's supposed to have a Scottish accent I'm offended
0.00036076073452406067,First a coat Now a pair of sunglasses Next it'll be a limb lost
0.0003602978236817274,the teams that face Barca and Bayern after a defeat are the ones who face the wrath
0.00035958726994643264,Will I offend you if I am truthful but kind or will you see why  haikuchallenge offend
0.0003594879244374008, Aye There's a brief window in both morning and afternoon otherwise just horrific until late evening
0.00035934837941982396,minutes with an incense and all I get is Rattatas   _emoj_joy_  PokemonGO
0.0003587716687750242,  Cancelling home Fibe Internet and TV this afternoon  as soon as I can arrange alternate Internet  fedup
0.000358649599791262,Jesus wept Another RNS from rusty  quote 'Price sensitive news Price Sensitive news' etc etc The Ramping here is shocking
0.00035857713077134574, switch host no bullet rage
0.0003585446096504635,testing angry
0.000358008903192757,  supporter  prejudice against disabled people disabledlivesmatter bully bbcnews skynews
0.00035785856940637835, does being a bully make u feel like a bigman Cos it makes u a twat
0.0003577822821687802,I polished my nails but can't find the polish remover It look like a 3yr old polished my nails lol horrible
0.0003577265744040485,and again dirty and  self loathing attitude  mope talking
0.00035766926789673834, yup I feel dirty cheering
0.0003575084365381399,   bully Bullshit fullofshit please take out the garbage
0.00035732943965961924, negative campaign of doom and gloom don't win elections
0.0003570747924692244,Everyday gay panic is STUNNING I drew guy's att'n to it when he blocked up a toilet stall's cracks wpaper towels TOTAL INCOMPREHENSION
0.0003569769625310339, I asked for my parcel to be delivered to a pick up store not my address fuming poorcustomerservice
0.00035672564874332367,India right of reply at UNGA  Pakistan preaching of human rights is by a country which is itself the global epicentre of terrorism
0.0003563759043663717, The worst customer service and lack of professionalism from this service provider phoneprovider badbusiness terrible
0.00035623897729438245,Although this war will be under the guise of combating terrorism it will in fact be a war against poverty ignorance and just stupidity
0.0003559632063087448,If yiu don't respond o an email within days you willxbe killed by an animated gif of the girl froa The Rig
0.00035575134792483214, Why does talksport sound like it's being broadcasted from someone's basement terrible quality amateurs
0.0003556284740190952,The book im riteing about wots happond has made them moor angry but im not here to plese man or hide the eval deeds of some
0.0003552840667465224, correction ppl Checked in Standing at the gate amp Flt took off without us 
0.00035519098446682687, I'm so mad for our clients I'm furious lmao
0.00035502072100780343,  MSM relentlessly saying DT can't win to depress GOP turnout amp provide cover stolen election
0.0003549590979331571,Pain is an aspect of human evolution the evolution of consciousness attachments desire apathy sentimentality tears fury anger O
0.00035461514642094483,Wow the Denver housing market is depressing no places to buy in my range   _emoj_cry_  FML
0.00035427899909890644,It's been a week of awful connectivity with  no service or only 4G is not what Im paying for unhappy poorservice
0.0003541320547218642,Scorpio always seek revenge
0.0003541220668996291, too grim too insanely determined to hurt you from
0.00035409711625463016,   don't ever compare those scrubs to benhe'll shake off your whole DL and throw a td
0.00035367745007073545,   This man is an affront to our justice system
0.00035358865185112744,This the most depressing shit ever
0.0003533696103495289,Absolutely fuming that some woman jumped into my prebooked taxi and drove off   _emoj_rage_ 
0.0003532572404809834,  clicked the wrong side was fuming   _emoj_sob_ 
0.00035322742272134335,  I hate winter I dread it's arrival
0.00035320935393772976, dilemma blaiming everything on the Bushes but acting gleeful over their endorsement Election2016 Trump
0.0003531898262301852,Now that I have my ex's number now its time to prank him revenge prank whatprankIshoulddo seriously what prank I should I do
0.0003530882679039503,So I wished my sis midnight but received no reply from her My 2nd sis JUST wished her got a reply You know who's the fav offended
0.000353084821477989, never thought an angry oompa loompa would be my Boggart but there you have it boggart PresidentTrump nightmare
0.0003530702165098623, I'm surrounded by those Trump voters You're right it is fucking terrifying redstate 
0.0003529837196453104,Their engine runs on fuel called whining   U jst  hv 2b observant Har din Rona dhona amp complain  Happy news makes them unhappy 
0.00035287007301252704,Mou is too jovial and trying to impress those players too much No player is bigger than manutd SAF won't tolerate all this bs 
0.0003527181429246976, I asked for my parcel to be delivered to a pick up store not my address  poorcustomerservice
0.0003526272987415717,Hey man are you asian' Nah man im hispan'nah you just high as hell' Some random crackhead in the walmart parking lotcmon sober
0.00035250132472723237,What the fuck is he even doing  He should be off that's fucking horrific 
0.00035247394053888024,   due to hearty lawsuit NASCAR will raise beer prices to accommodate for losses
0.000352360975321527,That free kick from Rooney was awful
0.0003521134179101949,Y'all really insult coz of soccer  Lmao wow
0.0003516037494982038,Boycotting  till butter pecan comes back I am furious
0.0003514619180474143,Some moving clips on youtube tonight of the vigil held at Tulsa Metropolitan Baptist church for TerenceCruther justice anger sadness
0.00035133734955110704, Dafron is hands down the biggest loser on the planet Typical bully lifer
0.00035123356802719337,firsttweetever sippin hotchocolate wondering why I finally gave in lt3 haha hellloooootwitter  its because facebookisforfamily rage
0.0003512063000839153,     Wrongdoing  Grrr  After the fact I know but emailing displeasure now anyway 
0.00035071472581154977,X X Do you hear me Darn Your optimism led to your own demise  You should lilive ZeroBOT
0.0003506695981206354,Nor hell a fury like a woman scorned  William Congreve
0.00035033360709984824,Today has dragged on 
0.0003501676358337569, Where is your indignation and outrage over the UNARMED DEAF WHITE man who was shot and killed by black officer in CLT NC
0.00035003294267257955,No offense but to the ppl out there using creams to build your glutesCOME ON Go squat and what not
0.0003500268622170237,I'm not use to getting up early asf this shit goin irritate me
0.00034997544687916267,    he'll defend his belt against aldo after its not that hard u grudge holding bitch
0.00034989525342004994,  What can't you grasp Besides yr cognitive dissonance raging away Each Incident Re LEOshooting  SEPARATE
0.00034975568209098215,significantly with a bitter smile 'let me
0.0003496806635001821, minutes late amp counting horrible CTT Service sucks
