rank,Tweet
0.0005330746312617758,When you want to say something so bad but can't  furious   _emoj_triumph_ 
0.0005302129617544815,People are hurt and angry and it's hard to know what to do with that anger Remember at the end of the day we're all humans bekind
0.000528133579385599, this is so absurd I could laugh right now if I also didn't feel like crying for the future of our country despair wakeupcall
0.0005280865652450631,In  fact  sometimes i don't get furious at people who wrong me but   i get  furious at  myself  for being  a  fool
0.0005277027205117751,I'm not used to pretty girls that use curse words to express their anger I just feel like I'm a little bit surprised and turned off as well
0.0005261739792180468,Turns out 'it' wasn't even anything to be concerned about at all Im happy and a bit frustrated it took so long to get this answer
0.0005252202392194795,i hope this comes back to haunt you then maybe you would know just how it felt to be like me at my lowest
0.0005246135272054473,Sometimes I get mad over something so minuscule I try to ruin somebodies life not like lose your job like get you into federal prison anger
0.0005241602601590141,I really really resent having to go to bed at a sensible hour you guys I WANT TO TALK TO MY PEOPLE
0.0005240978969751592,You ever just find that the people around you really irritate you sometimes That's me right now   _emoj_unamused_ 
0.0005233196155701921,You sure have a lot to say about something that doesn't even concern you   _emoj_wink_ 
0.0005232739445003981,How the fuck do we live our lives admiring everybody that ever just did something to win it then be afraid to even try to do it yourself
0.0005229219857214341,Side chick's be trying to fuck u like your going to forget about your wife when your done terrible
0.0005218831786989204, yes Once I'm done with people I'm really done lying to me is the worse thing someone can do I'm a nightmare   _emoj_joy_ 
0.0005216008211376147,one month til someone's bday and i think it's time to flaunt that I got them something pretty awesome revenge
0.0005215633133536754,And she got all angry telling me 'but what would be doing a year old guy looking for a girl like you' and I felt 
0.0005209591818011811,  even if he says nothing he'll still piss some people off He's gotta decide who he wants to make angry
0.0005208631553673502,And she got all angry telling me 'but what would be doing a year old guy looking for a girl like you' and I felt offended
0.0005207692962796852, I know she did horrible shit but it wouldn't make anything better in the end but your choice
0.0005204977895323407, I was pretty sure it was a Golden Ticket Get a tour Make a mistake Something horrific will happen to you Good day sir
0.0005204066665427695,That boy so intimidated he go back and say dumb mess like that   _emoj_thinking_face_ lol boy please you know good and well
0.0005199013072437118,On my life I'll never understand why anyone would pay money to see  terrible
0.0005195586146635995,I hate when people say 'I need to talk to you or we need to talk' My anxiety immediately goes up
0.0005193983517806472,Ugh I want to punch a wall every time I have to use  Literally the worst product ever made windows10 awful killme
0.0005183739027762293,The best revenge is to move on get over it and continue to succeed Never give someone the satisfaction of watching you suffer
0.0005178762700466217, I'm sorry about your loss no one should ever give you shit for taking your time to mourn No matter how long it takes
0.0005172053681807878,I sit at home so damn much that everything is starting to irritate me  I need to get out the house by myself 
0.000516844855515733,im tired of people telling me the worry about me when in fact they probably never gave a fuck about me
0.0005168342046867003,You boys dint know the game am I the game life after death better chose and know who side you on before my wrath does come upon us  _emoj_triumph_   _emoj_triumph_   _emoj_triumph_ 
0.0005168116559410993, People will always get offended everyone's situation is different Just because we have kids doesn't mean we have to settle
0.0005165708633645461,Sometimes I get mad over something so minuscule I try to ruin somebodies life not like lose your job like get you into federal prison 
0.0005161565272993688,I can see how this will end In all its bitter tragedy I'll give you all I have to spend And you'll give nothing back to me
0.0005160223890952539,Sometimes I watch shitty tv to reinforce never giving up cuz if something is that fucking awful on tv I still stand a chance optimism
0.0005153786346347188,I wish I could live in y'all reality where i can grieve over people i never met To bad i got BROTHERS dying left and right 
0.0005152844315855222,  I'd rather see KYLE from bbcan play again and THAT is saying something awful
0.0005151083455976187,Side chick's be trying to fuck u like your going to forget about your wife when your done 
0.0005140638565462029,There's always that one song which makes you turn of the radio as you'd rather sit in silence   _emoj_rage_  awful
0.0005138982699269372,I don't mean to offend anyone but literally blames everything on white people In some cases it's true but a lot of times it's not
0.0005131110340169508,Note to self  Stop laughing at things that offend you it's ok to get mad at people   NoteToSelf  mad upset
0.0005131045689294348,I wonder what would happen if I were to tell some people the truth savage uhoh angry
0.0005131030324128461,it's sad when you talk to someone about ya past n how it fucked you up and then they do the same thing like people really don't have hearts
0.0005130851344942336,Just had a massive argument with my alarm today I didn't want to get up I don't know how we're going to fix this by tomorrow morning   _emoj_confused_ 
0.0005127764030944632,a good shorty has so much to offer amp it's sad that some of you niggas don't even see it when she right in front of your face and too late
0.0005127104112990558, please fire don lemonDo not let him report on anymore  protest He is horrible negative and runs away from the issue at hand
0.0005126924412341699,Sometimes I watch shitty tv to reinforce never giving up cuz if something is that fucking awful on tv I still stand a chance 
0.0005126521828462365,felt a bit shit getting a very high blood sugar then i remembered it's my first one above this week which is incredible for me happy
0.0005123612149286462, hard to tell in your pic My mistake then Either way nothing I said initially was about race U took it there  ignorant
0.0005121378478753532,I love my black people I really really do But  my people really do irritate the living hell outta me all cause I'm different   _emoj_expressionless_ 
0.0005119836237105436,Ugh I want to punch a wall every time I have to use  Literally the worst product ever made windows10  killme
0.0005119211923845864,Can we get a shot of Lingys face at time  Pretty sure it would be more red then his hair fuming pretendinghesok ruok AFLCatsSwans
0.0005114942174922439,This brother know we know that his life was not in danger This gun law got people in this country fearing for their life White people
0.0005110988980876449,Everybody talking about 'the first day of fall' but summer '16 is never gonna die revenge 
0.0005110862707497231,Hey folks sorry if anything offensive got posted on here yesterday my account got hacked All fixed now though I hope  angry annoyed
0.0005110643509783181, I didn't say anything bad about the situation great mate can't believe some were Makes me despair of humanity
0.0005108435607109814, something needs to be done about people hogging machines  nobody can use machines at one time angry notfair whypay
0.0005104378090600432,You want  bad service use frontier they have terrible service Go to ATampT anybody is better I am going to complain to better business
0.0005102760284843201, the best revenge is to get yourself a good woman and move on Leave her and her hairline to figure themselves out alone
0.0005102491428816952,I've learned to let go of resentment for people who have hurt me because keeping it is like swallowing poison and expecting them to die
0.0005099152557132696,I just love it when people make plans for me without actually including me in this process rage
0.0005095122661324267,  _emoj_tired_face_  ughh I just want all this to be over it's like a nightmare can we all just get along
0.0005095122661324263, uf62b ughh I just want all this to be over it's like a nightmare can we all just get along
0.0005094850537621856,On my life I'll never understand why anyone would pay money to see  
0.0005094272522823113,I saw someone discourage someone from following their dreams Just because you want to live in mediocrity doesn't mean someone else should
0.0005094207094957062, it's funny how they can be in such a hurry but have plenty of time to stop and threaten people
0.0005088254683649529, than straight people Even the arse straight guys who think that means a threesome is fine angry fuming
0.0005086350744631003,When someone tells you they're going to 'tear you apart' and all they have to say is 'why are you so tall' shocking
0.0005086194539454949,Sorry  definitely going with  next time this is beyond unreasonable  terrible yourappologiesmeannothing
0.0005083653909476741,When my life became such a concern to irrelevant ass people I'll never know
0.0005082665697246698,Hey folks sorry if anything offensive got posted on here yesterday my account got hacked All fixed now though I hope   annoyed
0.0005081510785087447,if you're unhappy with someone just fucking tell them you're unhappy and leave Don't go fuckin around with other people on the side
0.0005079222838807608,The feeling of taking someone's life is either scarring or exhilarating but for people need to realize that we're going to die at some
0.0005078735726012532,Halfway to work and I realize I forgot to put on underwearIt's going to be one of those days mombrain toomuchgoingon longday 
0.0005074646744337294,  is that an insult Sounds like a job well done it's red so it's done the job it was suppose to do justsaying
0.0005071719216734538,  I guess It's just heartbreaking the ease with which they can kill an innocent man and get away with it 
0.0005070266013791817,I don't want the pity of my instructors but I'd like some understanding I'm truly trying despite ALL circumstances that make me discouraged
0.0005069442732196874,Note to self  Stop laughing at things that offend you it's ok to get mad at people  NoteToSelf offended mad upset
0.0005068676395049508, I wouldn't bring this up if I were you It's a very touchy subject And people get way to offended these days
0.0005067275825142269,Guy across from me in a really ugly suit cannot stop expressing his displeasure
0.0005065182415852216, unless your concern is people figuring out who you are for wtvr reason I don't see why you shouldn't tweet about other things
0.0005060417332061617, why do you even beef Sara you let the anger get the best of you you and Sagin been friends for how long
0.0005059709533007086,I'm about to block everyone everywhere posting about the storm I think everyone is aware of the damn rain and what not so quit damn rage
0.0005056214956949412,felt a bit shit getting a very high blood sugar then i remembered it's my first one above this week which is incredible for me 
0.0005053999223721589,I almost feel offended that she thinks that's a big deal She's knows I'll literally do anything for her or Kai
0.0005051629193001962,Dear hipster behind me at the game I am finding it very hard to pay attention while you talk about the politics of grapes of wrath SHUT UP
0.0005049857839397081, when are people going to realize that these 'riots' are just perpetuating hate Saying you're going to boycott a city lost
0.0005048571151458515, 'Well it can go one of two ways You either get over it and accept it because it's not going to change or you mope about 
0.0005048386777934842,Being abroad is causing me to make spontaneous decisions and not worry about things which is good but the type A part of me is fuming
0.000504673912451166, appointment booked between today waited in all day and nobody showed up also requested a call back and never got one awful
0.0005045497857374219,never make a decision when you are  angry gt_lt  and never make a promis when you are happy  
0.0005042483484079856,  I guess It's just heartbreaking the ease with which they can kill an innocent man and get away with it indignation
0.0005039219636579846,Nothing else could possibly put a damper on my day other than doing Xrays on someone with kickinnnnn ass breath   _emoj_crying_cat_face_ 
0.0005037858350315964, Actually wait I do the constant outrage thing gets on my wick sometimes and it happened to flick my annoyance today 
0.000503701830002037,Think I really broke young bull hurt   _emoj_joy_   _emoj_joy_   _emoj_sob_   _emoj_sob_  u can tell by how bitter and mad he is   _emoj_blush_   _emoj_blush_   _emoj_weary_   _emoj_weary_ 
0.0005036678548489827,   make sure you tell them how scared you are revenge   _emoj_raised_hands_   _emoj_fitzpatrick_type_3  _emoj_raised_hands_   _emoj_fitzpatrick_type_3
0.0005035406439242561,  Whaaaat Oh hell no I was jealous because you got paid to fuck but this is a whole new level anger love conflicted  _emoj_grimacing_ 
0.0005035113496977462,Seeing double am so tired but I always grudge getting off my phone at night   _emoj_face_with_rolling_eyes_
0.0005034392545865396,Sorry  definitely going with  next time this is beyond unreasonable   yourappologiesmeannothing
0.0005033698945673338,You will never find someone who loved you like I did And that my love will be my revenge
0.0005032069153144383, Ikr people still got a grudge against him for no reason like wtf
0.0005031673754412623,I get so angry at people that don't know that you don't have a stop sign on Francis and you do at Foster road rage
0.0005031280371192229,How hard is it to get in touch with  One simple question I can't find answer to on website and hour waiting for online chat rage
0.0005030764240565915,sorry im so bitter i just i either want a pure ur or literally any card from the sets i like but every time i draw for the sets i likegt
0.0005027913204108642,But if you wish to live bitter because your guilty conscience made you think it applied to you as well then that's on you I'm not sorry  _emoj_information_desk_person_   _emoj_fitzpatrick_type_1_2_  _emoj_blush_ 
0.0005024056294771683,I am real sjw I will not let america down I have found us now go and get us I let it out and I let it in I rage I lol 
0.0005023352416441528,Body is sleepy but the mind is active So sad Have to get ready for work in minutes Damn 
0.0005023219368432251,Do not be angry with God because you do not get what you want for God gives most when you expect least
0.0005022773379578414, ITS ALREADY FUCKING  Ok well I love having panic attacks in the afternoon
0.0005022601879579422,There's always that one song which makes you turn of the radio as you'd rather sit in silence   _emoj_rage_  
0.0005022403385469998,New play through tonight Pretty much a blind run Only played the game once and maybe got levels it Rage horror
0.0005020396970303329, we know the truth about her the public is figuring it out Her words mean nothing unhappy mean troubled vile 
0.0005018679168596315,At least I don't have a guy trying to discourage me anymore in what I want to do he will never become anything worth contributing to society
0.0005018197528685812,  The point of voting for Trump to push all the pieces off the board game like an angry toddler Wreck everything for everybody
0.0005017402440646591,Some of these fb comments andor tweets should make some people realize why black Americans feel the way they do   _emoj_flushed_  terrible
0.0005014405642732521,no offense but could troye start dming people so i can feel like less of an idiot when i dm him thanks
0.0005011895891255215,Actually be arsed with my sister sometimes she controls the TV of the time and when I watch one thing she gets in a huff   _emoj_face_with_rolling_eyes_
0.0005011460096687657, we know the truth about her the public is figuring it out Her words mean nothing  unhappy mean troubled vile bully
0.000500970773456149,You complain all the time and then wonder why people never want to see you You acc rile me up Stfuuu
0.000500836169865296, they never posted stuff like this i mean i was able to scroll over it so it wasnt a big deal but it was shocking
0.0005007107124702977, you're right choice I had to slam him he is one ignorant man and I really resent that statement Don King is an embarrassment
0.0005006721074418166,It's so funny cause Cooper's going to go farther than the people who bully her
0.0005005904761161343,Finally uploaded the file I needed to the university server's drop box It took like half an hour and a lot of cursing and anger on my part
0.0005003134740360669,When you've still got a whole season of Wentworth to watch and a stupid cunt in work ruins it for us   _emoj_sob_   _emoj_sob_    oldcunt
0.0005003071525083117,No respect for people who force their opinions on to others yet get offended when someone does the same to them   _emoj_joy_ 
0.0005002042137843853, I'm always a little bit weary of speaking up because I don't want to hijack the convo  as an LGBT person I've seen
0.0005000814142908042,I either look like a raging bitch or I'm obnoxiously laughing at something not that funny I don't think there's any middle ground
0.0005000450481664575,I mean I'm not done watching the pilot but it's nice to see a group of actors perform without story lines dripping relentless nihilism
0.000500028350869336,Forgiveness might make us look weak but the weakest person is the one who holds anger hatred and revenge
0.000500028350869336,Forgiveness might make us look weak but the weakest person is the one who holds anger hatred and revenge
0.0005000155542546703,Pro Tip Go back to work when your kid reaches mos old  Stay home any longer and you'll be absolutely miserable with the tantrums
0.0004998913842335172,Sounds like Donald Trump has spent today just making extra extra sure he'd get those frightened white conservative racist votes
0.0004998493295006486,Lol little things like that make me so angry x
0.0004998440952001696,So I've decided to go talk to Mr Smithrud about that creepy fucking guy since he gave me a fucking anxiety attack this morning
0.0004997376687704377,A liar an a bully for president They say every vote matter  well  I'm sorry you'll not get my vote until the year
0.0004997106250012993, trouble' he feigned anger and gave her a look that told her to behave He knew she wouldn't though and that was one of 
0.0004996851867465214,i swear people dont wanna see me happy like they will try to do anything to fuck up what i got going
0.0004993515530288913,Pro Tip Go back to work when your kid reaches mos old  Stay home any longer and you'll be absolutely miserable with the 
0.0004992300287469295, Wow did you get a really good buy on a bunch of '70's movies There were bad then and are worse now 
0.0004990016605531827,When you've still got a whole season of Wentworth to watch and a stupid cunt in work ruins it for us   _emoj_sob_   _emoj_sob_   raging oldcunt
0.0004989712527568134,A wise man told me that holdin' a grudge is like Letting somebody just live inside of your head rent free
0.0004989115867259371,New play through tonight Pretty much a blind run Only played the game once and maybe got levels it Rage 
0.0004986673789952595, lt feel everything She would remember everything Evanora hoped this would serve to fuel the creatures anger and run rabid gt
0.0004985482571193424, i dont understand why u do videos every week spend time with your family instead of working on horror takeabreak
0.0004983887623148295,Why do people gotta start so much drama  Shoot me   _emoj_white_frowning_face_  ufe0f
0.0004980446030875809, 'Kylie you know me I won't take no for answer for this kind of things' he would smirk and start on the crust
0.0004980416441435005,People need a way to escapeescape whatThis corrupted worldThis reality This jokeThis fury of constant pain amp stressWe need a vacation
0.0004980135340140183,     Apparently nothing like the terror cops have of black people
0.0004979663615484675,Even after  ref the xa35k fraud they still treat me like dirt No returned calls or apology shocking customerservice  
0.000497720071609746,I just love it when people make plans for me without actually including me in this process 
0.0004974657054472613,Finding out my two best Fwendz are going to rage with me at  makes this last week of no sleep extra worth it
0.0004973820960920206,when you find out the initiative isn't even a thing   _emoj_anguished_  revenge
0.0004971209144698957,  Maybe also being attacked by Tom's rabid fans to whom he amp his clothes were always perfect also put me off him
0.0004970776548323429,It's ThirstyThursday which means it's time to rage Get ready for tonight with personal hydration Book now itslit miami
0.0004970446912315267,It's way too hard not to get discouraged
0.0004969721118990771,ahs6 every minutes I've been saying 'nope nope I'd be gone by now' 'MOVE' or 'GTFO' so thank you for the fear
0.0004969509568092843,  I could not believe that their answer to his outrage was that they were right I do hope he takes them to the cleaners
0.0004968475194400778,I'm about to block everyone everywhere posting about the storm I think everyone is aware of the damn rain and what not so quit damn 
0.0004963600009732521,Forgiveness might make us look weak but the weakest person is the one who holds anger hatred and 
0.0004963019502084625, hahahahahaha Oh gosh You are hilarious A black man trying to keep racism alive Get out of here man
0.0004958176741593764,I think it's time to change my irate motif now that TalkLikeAPirate Day is over butPirate Minion is so cute I don't want to   _emoj_worried_ 
0.0004957027892626557,There's this Bpharm4 guy Eish that guy brings anger into my life When I see him nje like darkness fills me  will know
0.0004953482182590918,And im not even going to get into how its discriminatory to several religions which mandate its followers to let their hair dread
0.0004948091732986736,you come running back to me saying how much you miss me then cower away when we acc try a friendship   _emoj_thumbsup_   _emoj_fitzpatrick_type_3
0.000494659552351034,so fucking sad when the person you love doesn't try fighting for your happiness when you'd do anything for them
0.0004946555118621739,Sorry guys I have absolutely no idea what time i'll be on cam tomorrow but will keep you posted fuming
0.0004946019006613386,Americans as a whole are for the most part feeling borderline despair at the very least Looking at a situation out of control
0.0004945645793695703, She was winning this war that had been raging on inside of his mind The desire and love all rolling into something he 
0.000494394532512579,  Whaaaat Oh hell no I was jealous because you got paid to fuck but this is a whole new level  love conflicted  _emoj_grimacing_ 
0.0004943629649300149,Brb going start killing random white people going about their normal days Don't worry though i'm white so they will safely apprehend me
0.0004941336554970607,I get so angry at people that don't know that you don't have a stop sign on Francis and you do at Foster road 
0.0004939571854390128,So much terrible music playing on the radio has started to make me wonder weather my taste in music is good or just completely shit
0.000493841525918105, 'I know you trusted me' His words were soft as he ignored the anger and focused on the hurt beneath 'I know I screwed up' 
0.000493734360970014, that is one thing but attacking and hating is worse  that makes us just like the angry vengeful behavior we detest
0.0004935557168128924,Because it was a perfect illusion but at least now I know what it was angry ladygaga iscalmingmysoul
0.0004935310051770832,Women don't like girls because we resent them for looking so greatwe wish we still looked like that  washed
0.0004931974634044186,How hard is it to get in touch with  One simple question I can't find answer to on website and hour waiting for online chat 
0.0004929262593826508,If Monday had a face I would punch it monday horrible face punch fight joke like firstworldproblems need coffee asap follow
0.0004927200883148328,  don't get me started on town centre Used to go every week not been for months horrible
0.0004926802681821408,Having one of those angry days I will have to stop watching news
0.0004926365617074577,Imagine being bitter when your bias is dating amp sending threats to their partner Like why That's nasty And they don't even know you exist
0.0004926244271179172, some weeks there are no problems but this week is unbelievable  are you guys even running regular buses awful solate
0.000492608016371237,remember when glee did a take me or leave me cover but it was between two girls who werent even friends why did that do that
0.0004924138010131709,I really wish my road rage wasn't so damn bad lmaooooo
0.0004923493008336245,When it comes to Syria I get very fucking annoyed at pessimism like I get full on triggered Optimism or gtfo
0.0004922352018527884,or when someone tells me I needa smile like excuse me  now I'm just frowning even harder are you happy
0.0004921687806606564, I try not to let my anger seep into reviews but I resent having my time wasted on books like that Time is precious
0.0004920939138816885,  Although I don't expect a trumpie to understand the difference between real things and pretend things 
0.0004920473911778371, She could sense the anger stirring within him and took his hand in hers As long as we stay together we'll both be safe
0.0004920013951492347, yes hc and we got him very low I know how it feels Our damage is low enough as it is never mind having the rng of being enrage
