rank,Tweet
0.0005260978930741031, this is so absurd I could laugh right now if I also didn't feel like crying for the future of our country  wakeupcall
0.0005254909308057851,When you want to say something so bad but can't  furious   _emoj_triumph_ 
0.0005221751116693437, this is so absurd I could laugh right now if I also didn't feel like crying for the future of our country despair wakeupcall
0.0005206385649966116,People are hurt and angry and it's hard to know what to do with that anger Remember at the end of the day we're all humans bekind
0.0005186999770833505,I'm not used to pretty girls that use curse words to express their anger I just feel like I'm a little bit surprised and turned off as well
0.0005184586120148512,Some questions you get on Twitter make you want to despair We've been so battered We complain but aren't convinced things could be better
0.0005177517837615838,In  fact  sometimes i don't get furious at people who wrong me but   i get  furious at  myself  for being  a  fool
0.0005175910569371292,Sometimes I get mad over something so minuscule I try to ruin somebodies life not like lose your job like get you into federal prison anger
0.0005172806934217415,You sure have a lot to say about something that doesn't even concern you   _emoj_wink_ 
0.0005169965629872633,Turns out 'it' wasn't even anything to be concerned about at all Im happy and a bit frustrated it took so long to get this answer
0.000516479882305633,You ever just find that the people around you really irritate you sometimes That's me right now   _emoj_unamused_ 
0.0005156700407306283,I really really resent having to go to bed at a sensible hour you guys I WANT TO TALK TO MY PEOPLE
0.0005144156688259512,On my life I'll never understand why anyone would pay money to see  terrible
0.0005143253077838205,  even if he says nothing he'll still piss some people off He's gotta decide who he wants to make angry
0.0005137199137018443, yes Once I'm done with people I'm really done lying to me is the worse thing someone can do I'm a nightmare   _emoj_joy_ 
0.000513447686615497,Side chick's be trying to fuck u like your going to forget about your wife when your done terrible
0.0005130254541059528,I need to stop second guess myself and just go with the first thought and go with it relentless
0.0005127626953192228,That boy so intimidated he go back and say dumb mess like that   _emoj_thinking_face_ lol boy please you know good and well
0.0005124801506512313,I hate when people say 'I need to talk to you or we need to talk' My anxiety immediately goes up
0.000512108867555659,I sit at home so damn much that everything is starting to irritate me  I need to get out the house by myself 
0.0005113226583383461,How the fuck do we live our lives admiring everybody that ever just did something to win it then be afraid to even try to do it yourself
0.0005108366836797451,And she got all angry telling me 'but what would be doing a year old guy looking for a girl like you' and I felt 
0.0005106945928575298, I know she did horrible shit but it wouldn't make anything better in the end but your choice
0.0005103843781374113,And she got all angry telling me 'but what would be doing a year old guy looking for a girl like you' and I felt offended
0.0005088087242326254,Ugh I want to punch a wall every time I have to use  Literally the worst product ever made windows10 awful killme
0.0005075286955690027,I can see how this will end In all its bitter tragedy I'll give you all I have to spend And you'll give nothing back to me
0.0005075162780841719,  yeah I know it unless our offense can get something going That's a big if
0.0005071763853479611, I'm sorry about your loss no one should ever give you shit for taking your time to mourn No matter how long it takes
0.000506892101960337,  I'd rather see KYLE from bbcan play again and THAT is saying something awful
0.0005067854489269204, People will always get offended everyone's situation is different Just because we have kids doesn't mean we have to settle
0.0005067538895890382,im tired of people telling me the worry about me when in fact they probably never gave a fuck about me
0.0005065997580579463,The secret to all of every industry just start doing itsomehow people forget that they never gave you permission'  
0.0005062193158010412, hard to tell in your pic My mistake then Either way nothing I said initially was about race U took it there sad ignorant
0.0005059154639873902,I don't mean to offend anyone but literally blames everything on white people In some cases it's true but a lot of times it's not
0.0005058435109457918,Don't think I'll ever get used to this alarm   _emoj_weary_   _emoj_zzz_ 
0.0005056232334878072,Sometimes I watch shitty tv to reinforce never giving up cuz if something is that fucking awful on tv I still stand a chance optimism
0.0005054742205327589,I wish I could live in y'all reality where i can grieve over people i never met To bad i got BROTHERS dying left and right 
0.0005054468708090223,Side chick's be trying to fuck u like your going to forget about your wife when your done 
0.0005051090693871198,You boys dint know the game am I the game life after death better chose and know who side you on before my wrath does come upon us  _emoj_triumph_   _emoj_triumph_   _emoj_triumph_ 
0.0005046641264163775,Just had a massive argument with my alarm today I didn't want to get up I don't know how we're going to fix this by tomorrow morning   _emoj_confused_ 
0.0005043372768976372,You want  bad service use frontier they have terrible service Go to ATampT anybody is better I am going to complain to better business
0.0005041996393674574,On my life I'll never understand why anyone would pay money to see  
0.0005041422546571777,I wonder what would happen if I were to tell some people the truth savage uhoh angry
0.0005038637268653113, I didn't say anything bad about the situation great mate can't believe some were Makes me despair of humanity
0.0005038259607907503, please fire don lemonDo not let him report on anymore  protest He is horrible negative and runs away from the issue at hand
0.0005038223343876506,I love my black people I really really do But  my people really do irritate the living hell outta me all cause I'm different   _emoj_expressionless_ 
0.0005033285173775082,Can we get a shot of Lingys face at time  Pretty sure it would be more red then his hair fuming pretendinghesok ruok AFLCatsSwans
0.0005030342028551385, something needs to be done about people hogging machines  nobody can use machines at one time angry notfair whypay
0.0005027790226814516, it's funny how they can be in such a hurry but have plenty of time to stop and threaten people
0.0005027541502598057,There's always that one song which makes you turn of the radio as you'd rather sit in silence   _emoj_rage_  awful
0.0005024448448291088,When someone tells you they're going to 'tear you apart' and all they have to say is 'why are you so tall' shocking
0.000502289995524536,Sorry  definitely going with  next time this is beyond unreasonable  terrible yourappologiesmeannothing
0.0005020589269496448,Sometimes I watch shitty tv to reinforce never giving up cuz if something is that fucking awful on tv I still stand a chance 
0.0005015994655200764, hard to tell in your pic My mistake then Either way nothing I said initially was about race U took it there  ignorant
0.000501397132517078,Hey folks sorry if anything offensive got posted on here yesterday my account got hacked All fixed now though I hope  angry annoyed
0.0005011121978289968,Ugh I want to punch a wall every time I have to use  Literally the worst product ever made windows10  killme
0.0005010569319863591,I saw someone discourage someone from following their dreams Just because you want to live in mediocrity doesn't mean someone else should
0.000500658099431613,This brother know we know that his life was not in danger This gun law got people in this country fearing for their life White people
0.0005005031404563889, unless your concern is people figuring out who you are for wtvr reason I don't see why you shouldn't tweet about other things
0.0004999486354472178,if you're unhappy with someone just fucking tell them you're unhappy and leave Don't go fuckin around with other people on the side
0.0004998167604358661,Searching for someone to date   on Tinder at a bar through friends   can feel like an absurd nightmare Or at least a series of
0.0004996720575386968,The feeling of taking someone's life is either scarring or exhilarating but for people need to realize that we're going to die at some
0.0004993723813839053,Everybody talking about 'the first day of fall' but summer '16 is never gonna die revenge 
0.0004993692708304207,  _emoj_tired_face_  ughh I just want all this to be over it's like a nightmare can we all just get along
0.0004993692708304206, uf62b ughh I just want all this to be over it's like a nightmare can we all just get along
0.0004990237974661013,I feel ghastly and I'm really hoping it's just a postbirthday slump Back to full research mode tomorrow either way
0.0004990006471417812,Hey folks sorry if anything offensive got posted on here yesterday my account got hacked All fixed now though I hope   annoyed
0.0004989420802284227,When my life became such a concern to irrelevant ass people I'll never know
0.0004987276793923499,  YES  Right  I mean I wish you hadn't been discouraged to see MikeandMolly because so many parallels really 
0.0004986504684143552,Halfway to work and I realize I forgot to put on underwearIt's going to be one of those days mombrain toomuchgoingon longday 
0.0004984799783842312, than straight people Even the arse straight guys who think that means a threesome is fine angry fuming
0.0004978882107278358,Nothing else could possibly put a damper on my day other than doing Xrays on someone with kickinnnnn ass breath   _emoj_crying_cat_face_ 
0.0004978436210181832,LMAO this person must hate me so bad to talk shit behind an anonymous account awe 
0.0004977817323431544, Actually wait I do the constant outrage thing gets on my wick sometimes and it happened to flick my annoyance today 
0.0004977701171915778, which was worse than expected and hilarious too no one will even remember
0.0004976607029947663,  I guess It's just heartbreaking the ease with which they can kill an innocent man and get away with it 
0.0004976416988446878,I almost feel offended that she thinks that's a big deal She's knows I'll literally do anything for her or Kai
0.000497334255716216,Had a coworker look at her phone and say cheerfully 'oh look Kap's getting death threats now'   _emoj_face_with_rolling_eyes_  Then she goes to say the 49ers are
0.0004971775386626002,Sorry  definitely going with  next time this is beyond unreasonable   yourappologiesmeannothing
0.0004971761269794433, I don't even remember that part   _emoj_sweat_smile_  the movie wasn't terrible it just wasn't very scary and I expected a better ending   _emoj_face_with_rolling_eyes_
0.0004971393873548798,Might go on  tomorrow to hopefully win a new car My current one stinks of gone off milk grim
0.0004969869143245828, Eric couldn't help but laugh though that made him wince in pain It hurt A lot He just wanted to sit down somewhere  
0.0004966110766335881,I'm about to block everyone everywhere posting about the storm I think everyone is aware of the damn rain and what not so quit damn rage
0.0004964959193457338, when are people going to realize that these 'riots' are just perpetuating hate Saying you're going to boycott a city lost
0.0004964659286583492, I wouldn't bring this up if I were you It's a very touchy subject And people get way to offended these days
0.0004963429740741558, 'Well it can go one of two ways You either get over it and accept it because it's not going to change or you mope about 
0.0004954200866380454,At least I don't have a guy trying to discourage me anymore in what I want to do he will never become anything worth contributing to society
0.0004952732970731649,Guy across from me in a really ugly suit cannot stop expressing his displeasure
0.0004951825861690602,You complain all the time and then wonder why people never want to see you You acc rile me up Stfuuu
0.0004950178044177102,   make sure you tell them how scared you are revenge   _emoj_raised_hands_   _emoj_fitzpatrick_type_3  _emoj_raised_hands_   _emoj_fitzpatrick_type_3
0.0004948597029443977,Love being made to feel bad about being scared of the dark
0.0004947796027166192,Walk right through them See way past them and don't even hesitate running them over
0.0004946810581547029, we know the truth about her the public is figuring it out Her words mean nothing unhappy mean troubled vile 
0.0004946627680192606,And I would advise that everyone wait to watch  or actually don't wait just don't even watch it because it is awful
0.0004946578274002715,felt a bit shit getting a very high blood sugar then i remembered it's my first one above this week which is incredible for me 
0.0004944042335027105, appointment booked between today waited in all day and nobody showed up also requested a call back and never got one awful
0.000494389146561293,  I guess It's just heartbreaking the ease with which they can kill an innocent man and get away with it indignation
0.0004940699524062994,Dear hipster behind me at the game I am finding it very hard to pay attention while you talk about the politics of grapes of wrath SHUT UP
0.0004938803740857015,  Although I don't expect a trumpie to understand the difference between real things and pretend things sad
0.0004938312835826181,Think I really broke young bull hurt   _emoj_joy_   _emoj_joy_   _emoj_sob_   _emoj_sob_  u can tell by how bitter and mad he is   _emoj_blush_   _emoj_blush_   _emoj_weary_   _emoj_weary_ 
0.0004938091181614442, we know the truth about her the public is figuring it out Her words mean nothing  unhappy mean troubled vile bully
0.0004937983808508407,Seeing double am so tired but I always grudge getting off my phone at night   _emoj_face_with_rolling_eyes_
0.0004937267054261542,Ever been really lonely and your phone keeps blowing up but you just can't pick it up and respond to people  recluse issues
0.0004934957539118708,I get so angry at people that don't know that you don't have a stop sign on Francis and you do at Foster road rage
0.0004933132048167135, Wow did you get a really good buy on a bunch of '70's movies There were bad then and are worse now 
0.0004930436484350917,Honestly today I just felt like maybe track isn't for me 
0.000492963414754169,Actually be arsed with my sister sometimes she controls the TV of the time and when I watch one thing she gets in a huff   _emoj_face_with_rolling_eyes_
0.0004928860097253887,People too weak to follow their own dreams will always find a way to discourage yours
0.0004928815607858878, been better It's really stupid don't worry
0.0004928806772657801,I either look like a raging bitch or I'm obnoxiously laughing at something not that funny I don't think there's any middle ground
0.0004928009401227846,Honestly don't know why I'm so unhappy most of the time I just want it all to stop  unhappy depression itnevergoes
0.000492652584391581,no offense but could troye start dming people so i can feel like less of an idiot when i dm him thanks
0.0004921778125197164, Wow did you get a really good buy on a bunch of '70's movies There were bad then and are worse now awful
0.0004921319108048035,When you've still got a whole season of Wentworth to watch and a stupid cunt in work ruins it for us   _emoj_sob_   _emoj_sob_    oldcunt
0.0004919380081261304,Some of these fb comments andor tweets should make some people realize why black Americans feel the way they do   _emoj_flushed_  terrible
0.0004917488026199497,Lol little things like that make me so angry x
0.000491746671612244,People stealing things from my work out quite the damper on my day so now I am going to wear pajamas all day
0.0004916713505693709, they never posted stuff like this i mean i was able to scroll over it so it wasnt a big deal but it was shocking
0.0004916261836659565,  Whaaaat Oh hell no I was jealous because you got paid to fuck but this is a whole new level anger love conflicted  _emoj_grimacing_ 
0.0004915138025119132, ITS ALREADY FUCKING  Ok well I love having panic attacks in the afternoon
0.0004914747347266933, Ikr people still got a grudge against him for no reason like wtf
0.0004914576224629981,Forgiveness might make us look weak but the weakest person is the one who holds anger hatred and revenge
0.0004909120355313639,Thought I left that part of life behind me It's back to haunt every girl that loves me
0.0004908426722920426,  The point of voting for Trump to push all the pieces off the board game like an angry toddler Wreck everything for everybody
0.0004907555850152411,Body is sleepy but the mind is active So sad Have to get ready for work in minutes Damn 
0.0004906407318259607,How hard is it to get in touch with  One simple question I can't find answer to on website and hour waiting for online chat rage
0.0004906147844750863,There's always that one song which makes you turn of the radio as you'd rather sit in silence   _emoj_rage_  
0.0004905090233752158,sorry im so bitter i just i either want a pure ur or literally any card from the sets i like but every time i draw for the sets i likegt
0.0004904104952777528,I mean I'm not done watching the pilot but it's nice to see a group of actors perform without story lines dripping relentless nihilism
0.0004903209806166402,Sometimes I like to talk about my sadness  Other times I just want to be distracted by friends laughter shopping eating    MHChat
0.0004902559236356491,New play through tonight Pretty much a blind run Only played the game once and maybe got levels it Rage horror
0.0004902446144483456,i swear people dont wanna see me happy like they will try to do anything to fuck up what i got going
0.0004902418541362256,Honestly today I just felt like maybe track isn't for me sad
0.0004900612959115893,Sounds like Donald Trump has spent today just making extra extra sure he'd get those frightened white conservative racist votes
0.0004900226161384068, trouble' he feigned anger and gave her a look that told her to behave He knew she wouldn't though and that was one of 
0.0004899485502703107,It take so little to make a child's life joyful why do we work so hard to make their lives hell  Peace
0.0004899151643669198,Watched the movie friend request at 2am awhile ago in a dark cold night and it was one of the bad choices I've ever made nightmare   _emoj_cold_sweat_ 
0.0004898896229889352,Halfway to work and I realize I forgot to put on underwearIt's going to be one of those days mombrain toomuchgoingon longday breezy
0.0004898481825723484, you're right choice I had to slam him he is one ignorant man and I really resent that statement Don King is an embarrassment
0.0004895745412695578,No respect for people who force their opinions on to others yet get offended when someone does the same to them   _emoj_joy_ 
0.0004894977002057654,  I could not believe that their answer to his outrage was that they were right I do hope he takes them to the cleaners
0.0004892680648762516,A liar an a bully for president They say every vote matter  well  I'm sorry you'll not get my vote until the year
0.0004888487528924602,People need a way to escapeescape whatThis corrupted worldThis reality This jokeThis fury of constant pain stressWe need a vacation
0.0004887584099369138,Sorry guys I have absolutely no idea what time i'll be on cam tomorrow but will keep you posted fuming
0.0004887358890127845,Pro Tip Go back to work when your kid reaches mos old  Stay home any longer and you'll be absolutely miserable with the tantrums
0.0004886887104829337, lt feel everything She would remember everything Evanora hoped this would serve to fuel the creatures anger and run rabid gt
0.0004886019841621062,today has been terrible but tonight will end better because I get to see Malik   _emoj_heart_  ufe0f
0.0004885566920067665,Even after  ref the xa35k fraud they still treat me like dirt No returned calls or apology shocking customerservice  
0.0004884659498175579,Hate knowing I have to get up at half for gym in the morning it's so depressing
0.0004883804722066724, I try not to let my anger seep into reviews but I resent having my time wasted on books like that Time is precious
0.0004883401809272172, i dont understand why u do videos every week spend time with your family instead of working on horror takeabreak
0.0004883319843860077,Finally uploaded the file I needed to the university server's drop box It took like half an hour and a lot of cursing and anger on my part
0.0004882272801265819,I'm about to block everyone everywhere posting about the storm I think everyone is aware of the damn rain and what not so quit damn 
0.00048820703263824345,I just love it when people make plans for me without actually including me in this process 
0.00048811358789161227, I'm always a little bit weary of speaking up because I don't want to hijack the convo  as an LGBT person I've seen
0.00048807152406789,There's this Bpharm4 guy Eish that guy brings anger into my life When I see him nje like darkness fills me  will know
0.0004880237437132101,Ugh Why am I not asleep yet Fml I think low key I'm afraid I might miss something SleeplessNight sleepy 
0.0004880116590878866,     Apparently nothing like the terror cops have of black people
0.00048797891412791103,or when someone tells me I needa smile like excuse me  now I'm just frowning even harder are you happy
0.0004876567920551293,Pro Tip Go back to work when your kid reaches mos old  Stay home any longer and you'll be absolutely miserable with the 
0.0004876500464109243,Why do people gotta start so much drama  Shoot me   _emoj_white_frowning_face_  ufe0f
0.00048751792174681947,  Although I don't expect a trumpie to understand the difference between real things and pretend things 
0.0004871949728215877,ahs6 every minutes I've been saying 'nope nope I'd be gone by now' 'MOVE' or 'GTFO' so thank you for the fear
0.00048710990271812855,People are trying too hard to hate on Cam Newton without understanding his position sad
0.0004866627860266337,My house isnt always a mess but when it is its when i have friends coming mess serious twitter problem like friends filthy home
0.00048639339543061696, sadly at least more years of this At what point will even the low info selfie lovers who voted for them say enough is enough
0.00048629232783513814,I get embarrassed at the slightest things and then I'll fret about it all day I hate it
0.0004862484171148093,Brb going start killing random white people going about their normal days Don't worry though i'm white so they will safely apprehend me
0.00048591939965574624, that is one thing but attacking and hating is worse  that makes us just like the angry vengeful behavior we detest
0.00048573170837594806,when you find out the initiative isn't even a thing   _emoj_anguished_  revenge
0.00048572887384717105,  she has stayed off the block almost all season got out people that were good for her game but no one seemed
0.00048557727518555376,And im not even going to get into how its discriminatory to several religions which mandate its followers to let their hair dread
0.00048555301802290116, tend to them he's going to get infections   He's frowning and looking down as he does this  It must hurt damn
0.0004854622270750149, yes hc and we got him very low I know how it feels Our damage is low enough as it is never mind having the rng of being enrage
0.000485412735318778, hahahahahaha Oh gosh You are hilarious A black man trying to keep racism alive Get out of here man
0.0004853555018064693,you come running back to me saying how much you miss me then cower away when we acc try a friendship   _emoj_thumbsup_   _emoj_fitzpatrick_type_3
0.0004853117815055853,Terencecutcher Tulsa the man onthe helicopter said he looks like a bad dude that is the problem when they see black they see bad 
0.00048529658002965226,I get so angry at people that don't know that you don't have a stop sign on Francis and you do at Foster road 
0.00048490631237438,  Maybe also being attacked by Tom's rabid fans to whom he his clothes were always perfect also put me off him
0.0004848780222009043, 'I know you trusted me' His words were soft as he ignored the anger and focused on the hurt beneath 'I know I screwed up' 
0.00048454362715171607,Way to get a hold of her   _emoj_blush_  depressing
0.00048447983780989054,   she would frown a bit folding her arms 'why is it that every time I'm in need of assistance someone expects a lil 
0.0004843651721260732,I know few will mourn the loss of Stitch's Great Escape butsee THIS is the kind of costcutting at parks I really don't care for
0.0004843212757432675, ok thats it After weeks not being able to sign in time to move on find another app I will strongly discourage NikeRun
0.000484297240243643, something needs to be done about people hogging machines  nobody can use machines at one time  notfair whypay
0.0004841440799111172,Americans as a whole are for the most part feeling borderline despair at the very least Looking at a situation out of control
0.00048402523452179203,Like he really just fucking asked me that 
0.00048401997263929335,Projection is perception See it in someone else You also at some level have that within you anger worry
0.0004839326730063497,I HATE little girls   _emoj_rage_   _emoj_rage_  got a lot off growing up to do fuming
0.0004838896454762469,remember when glee did a take me or leave me cover but it was between two girls who werent even friends why did that do that
0.0004837756842464386,I really wish my road rage wasn't so damn bad lmaooooo
0.0004837348413693113,When it comes to Syria I get very fucking annoyed at pessimism like I get full on triggered Optimism or gtfo
0.00048365250362812114,I'm not afraid of clowns but I'm really hoping they don't make an appearance around my hometown
