rank,Tweet
0.00037320085549569356,  the refs are in GT's favor tonight terrible
0.00037314123716545786, Just to help maintain and boost our status as a world class centre for education culture and tolerance outrage
0.0003731250442113951,Bitch worry about me more than I worry about myself   _emoj_face_with_rolling_eyes_  _emoj_weary_ 
0.00037308858503758727, He grumbled as he sat atop the sushi bar stool crossing his arms defiantly in a playful gesture though he gave anyone who gt
0.00037296244461965436,    You can't be serious This man practices no religion Only in church campaignin
0.00037285563843822184,White people irritate me
0.0003728412468111742, that's what I'm afraid of
0.0003728124420648597, exactly what I have been saying on fb bitter
0.00037264687513268965, rescue my morning turned up to the gym an hour early before it opened nightmare   _emoj_white_up_pointing_index_  ufe0f
0.00037239265201863655,  I cancelled by CBS all access live feeds before JC even said Vic won AFP Paulshould have won IMO bitter
0.0003723467737432563, any tips on why our wifi is terrible the past week Slow or dropping out continuously  NW Calgary   _emoj_confused_ 
0.0003722870205894537,This uber driver TRIED it with me he'll feel my wrath
0.00037223255636954333, against Chelsea anything is possible haha I'm fuming about that bet   _emoj_face_with_rolling_eyes_  _emoj_face_with_rolling_eyes_  _emoj_face_with_rolling_eyes_  _emoj_face_with_rolling_eyes_  _emoj_face_with_rolling_eyes_  _emoj_face_with_rolling_eyes_
0.00037207359126281085, local solutions fine but not providers negotiating with LA'sIJB 's scare resources
0.0003720300002325119,Extremely bitter about the fact that the Subway in Robart's has been replaced with a lowrent version of Chipotle
0.0003718723667393738,When your body says FUCK YOU BITCH You ain't sleeping sleep cantsleep drained restless
0.0003718417996615128, Give it up Gas I don't hate u I just don't respect ur rudeness 
0.00037183948099002353, specifically are the cause of it all and they resent being considered the enemy
0.0003717445493924947, Give it up Gas I don't hate u I just don't respect ur rudeness bully
0.0003717274232530655,They gonna give this KKk police bitch the minimum sentencejust wattch 
0.0003716295143629254,I shower to lay in bed for about an hour then dread wearing pants for the remainder of the day
0.0003716230530667198,I heard Movie Bob was furious about the Skittles analogy He was upset that there wasn't actually any Skittles
0.00037162094452555745,I had Golden Ocean the other day it was lush then I gagged and was sick What a waste of xa320  I was fuming  I miss you
0.0003716191140676707,The animosity toward Hillary comes from conspiracy theories and perception the animosity toward Trump is based on what he says and does
0.00037148778865789674,My name is John Locke and you can't tell me what I can and can't do lost  u30a2 u30cb u30e1
0.0003714694953753263, I remember Joey slagging England player's off bringing out books after crap tournamentssame samecrap player bully
0.0003714213148516807,  evil rich white men and their fucking cronies in intelligencegovacademia using blithe blacks as fodder
0.00037137440854025886, What an awful team
0.00037124366943067045, I got a super speeder and lost my license for months   _emoj_weary_   _emoj_gun_ 
0.00037121712340595366,Sister Canadian player does something shady Jonathan Toews is frowning and he doesn't know why WorldCupOfHockey
0.0003711846507589247,  wow My bill is xa34477 and hav a text from u to prove that and you have taken xa3148 swines fuming con
0.00037116538629604356, never bring back Meech and Bridgette Crying because someone looks at you Ugh and Bridgette bitter
0.00037111624567061254,Farting in a hot are car when your windows don't roll down is terrible gag BresAdvice
0.00037109346536312035,internationaldayofpeace  When white supremacists terrorize everyone of differing cultures online and will continue it offline tomorrow
0.0003710601027624734,Trump supports reach another level of irritation within me
0.00037102670593783493,can't believe Achilles killed me angry
0.00037098904790466267,   the 'groovier' part is an affront to common decency No way  agrees
0.00037091155500937773,   Trudeau endulging on outrage culture once again Preaching issues ad hominembut never quanitfying them
0.000370727068893918,the ending of how I met your mother is dreadful
0.00037044140034961923, but your pussy was weak from what I heard so stfu up to me bitch  You got to threaten him that your pregnant 
0.0003702775987068318,Honestly there are some awful people on the internet smh
0.0003699799837033324,  saddest part of this whole mess is that all of this anger is misdirected they should march the WhiteHouse
0.0003698940444599068,India wants to shake hands with  pakistan  but as usual pakistan cheat with every indian   shameless pakistan
0.00036953547071832607,god Facebook's design has started to remind me of MySpace in its heyday
0.0003694693071284402,  frustration looking up at Elphaba in a frown of aggravation Her high pitched voice was growing more and more 
0.00036935961638233963,Dear  please tell your bus drivers if obstruction on their side DON'T just pull out to oncoming traffic causing vehs to swerve fuming   _emoj_rage_ 
0.0003692407403957641, zionist  terror  Imagine this kid was a Palestinian or Muslim Zionists stealing innocence of childhood from Jewish children
0.00036896879473899706,I hate freaking out and ruining things 
0.0003689644806386554,a vote for killary is like sticking a knife in a toaster shocking MakeAmericaGreatAgain
0.00036851069236698184,  Yeah it was sooo horrific I needed to sit down
0.00036849377251951647,My cat is bloody lucky the RSPCA weren't open at 3am last night fuming   _emoj_rage_   _emoj_cat_ 
0.0003684899128167391,  the beak on that woman is almost as shocking as the low IQ of her followers
0.00036848230017103327, then it's poor packaging my Amazon and the fulfilled seller should be furious as much as you   _emoj_confused_ 
0.0003684767803525572, spent over fucking hours and still can't get that dam SIVA fragment on Fellwinters peak mountain 
0.0003682392417607413,A country that gave safe house to Osama Bin Laden is dangerous if not contained Pakistan is a terror heaven declare so 
0.00036817136622203684,They want as police state they are fearful imbeciles   
0.000368003287979841,Point scorning and fury at Labor does nothing to address long term detention and the need to resettle asylumseekers from manus and Nauru
0.0003678830398097858,That is at least the 3rd time the balls been burst in our games
0.000367873040316777,    everyone is against wigan because we are the biggest club bitter
0.0003678561220495628,ppl talking about diets and i am feeling terrible hahaha
0.0003678458186607239,Height of irritation when a person makes a hilarious chusssss Plz die  _emoj_grimacing_   _emoj_grimacing_ 
0.0003677135231623949,All with weary task fordone Now the wasted brands do glow Whilst the scritchowl scritching loud AMNDBots
0.0003676342379061365,I'm also upset at my incorrect use of a comma grammar struggle hesitation backtoschool   _emoj_school_satchel_   _emoj_books_ 
0.0003675856125316917,Absolutely raging at the changes to CAS what a joke
0.00036739628958933133,I'm done with your piano blues playing smooth talking ass On to the nexttt
0.0003672989692208863,He's seriously so frustrating sometimes _emoj_white_square_  ugh raging
0.0003672968783325296,This whole VanRE  extradition might turn into a Pandora's box JT has no idea about that murky corrupt guanxi in China Toad vs Dada 
0.0003672341757859461,The majority of people irritate the fuck out of me cba with people ahahah
0.00036721263716567396, great programme tonight  upsetting extremeworld
0.00036658820220876253, Reaching out AGAIN in hope to contact over the technical issues I am having Your CS is severely lacking badkarma unhappy
0.0003664642857019318,I just killed a spider so big it sprayed spider guts on me like a horror movie ugh revenge
0.00036646031087567556,A pessimist is someone who when opportunity knocks complains about the noise
0.0003664192410472977, I remember Joey slagging England player's off bringing out books after crap tournamentssame samecrap player 
0.0003664068424040995,  i have hit a lot of irate villa fans lol
0.00036637154126619516,He's seriously so frustrating sometimes _emoj_white_square_ ugh 
0.00036630252071858955,If you let a general tweet offend you you definitely shouldn't be on twitter
0.00036624744577482443,How was Natalie one of the top three favorites toofaced and bitter   _emoj_face_with_rolling_eyes_
0.00036619387949880273,Yeah no I don' mind tweetin' that twice snap blm likeThat
0.00036602120621126856,  Stephen King never once spoke out about how the Left crushes FreeSpeech in publishing world   Trump  scifi ccot p2
0.0003660012342247877, stuck on runway after being diverted to Fargo Continuously told just more mins for the past hours No foodwater offered awful
0.0003658213416611706,  Its okay to be trans just rejoice with the trans in the trans way By the way it's not your business so why care
0.0003653296988992118, there was a US diver named steele johnson i'd like him barred from the olympics 
0.000365183068613764,GahhBT in queue for minutes Now put through to BT Sport dept to cancel back in a queue again shocking
0.0003651545166862039,If you ain't shaking no ass don't ask me for my liquor Rule
0.00036509932567306406,I hate it when im singing and some idiot thinks they can just join in with me likethis is not fcking glee MeanRikonaBot
0.000365085385343991,   huh We have a sprint coach We're the slowest team in the comp Talk about robbing a living outrage
0.00036508314000640506,Everyone is raging
0.00036480464854145875,He called me fat so I pushed him into the lockers then he threaten to sue me'   _emoj_joy_ 
0.00036479391051313855, happy anger sad melancholy confusion woodspurge
0.00036478600791753986, both are nonsensical If there's injustice against blacks why add to it by destroying black property It's misdirected anger
0.00036476179985698177,  Isn't OBrien supposed to be some sort of offensive genius awful
0.0003646951656086942,This pretentious dick in Night Gallery just fucking used a towel to dry off his sink
0.0003646618116955254,Omg someone asked them to sit and they reluctantly moved with a huff Biiitttccchhhhhh   _emoj_hocho_ 
0.00036462974716811963,burning the last of 
0.00036458237264242637, i Lowkey forgot you had twitter and if you don't follow me back im gonna be offended
0.00036425565569926335, i have unsubscribed times from your spam emails still coming STOP THE EMAILS avanquest software 
0.0003642420420632597, You have no Police credentialsYou were a litigator Nothing moreNo Experience Sad TrumpPuppet Felon  jersey4sale
0.00036414839529327073,As if he heard my thought on the ether my ex has just posted facebook pic of himself snuggling up with said cats now Im just 
0.0003641400134055739,I told my therapist that I'm on the dance team and now she's unhappy with me
0.00036406932839900505,Still can't log into my fucking SnapchatSnapchat snap
0.0003639838529713893,Aleppo city is burning The head of terrorism Assad regime Russia are bombarding the city right now with whitephosphrus bombs 
0.00036396917504549244, NO The gay guy and the dad revenge fucking
0.0003638858909934351,   I agree but our offense was ass after the second half td score on the first drive
0.0003637702913001584,Inpouring this letter we are dying over against subsist checking quaint virtuoso ways toward fine huff yours l
0.0003637297700834861,I wouldn't have anger issuesif she didn't have lying issuesthink about that one pow lies confusion
0.00036363234275441536,I got fever highs I got boiling blood
0.00036346440583993027,The underground at Waterloo is not a nice place to be at 830am on a Thursday somanypeople grim
0.00036329889075384424,All hell is breaking loose in Charlotte CharlotteProtest anger looting
0.00036326357383773466, species cf Don Jr refugeesSkittlesknow he likes his snacksbut even  frown on talking about eating humans lizardscum
0.00036285428904836176,Damn our offense is a mix bag of unpredictable lethal weapons I'm worried for Defense Coordinators   _emoj_grin_  Chargers Boltup Recharged
0.00036282715358552253, EA sports technical support team really suprised me   _emoj_blush_  SUPRISED ME AT HOW SHIT THEY WERE awful
0.0003627793120324405,I don't know what's worse the new Pizza Hut commercials or the pizza that Pizza Hut makes horrible
0.00036271509652269755,How the fuk Who the heck moved my fridge should I knock the landlord door angry mad 
0.00036264650667826385, 'll just wobble carry you sink
0.00036250639846441025,   Didn't Florida teach you anything I live here in Palm Beach County and lived through that nightmare
0.00036246906368473183,  You certainly wouldn't catch me with the multitude ghastly
0.000362420470638678,People that smoke cigarettes irritate my soul
0.00036218711817467077,Retweeted Dr Rand Paul   Stop fueling a Middle East arms race and worsening an already horrific refugee crisis in Yemen
0.0003619988437921825,Luis Ortiz ducked by Ustinov which means fights off and he left  future not looking to bright for Ortiz boxing
0.00036167698549146026, which onethe one where u threaten violence Or the phedophiliac u support  Or the constitution violations he proposes
0.00036165109099476765, coincidentally watched Ulzana's Raid last night  brutally indignant filmmaking
0.00036158184865591603,Yeah I'm hot nigga they say im burning uhhhhh
0.0003614705516305322,Back on my bully
0.00036137158817018685, why doesn't this account follow me offended
0.0003613114512205305,Mary Berry  what's the icing on top of your Bakewell tart It looks like horrid Mr Kipling not something Derbyshire would recognise GBBO
0.00036111840208645247,Unruly kids at 8am in the morning nothanks ripping the flower beds up by the roots while their parents watch 
0.0003611081044299428,mirana told me to shut up when i was singing along to glee
0.0003609215455840141,Biggest THREAT GLOBAL STABILITY climatechange food water security terrorism russia war trump clinton geopolitics korea vwo
0.0003605385568084325, I had to unfollow he got trolled by trolls His revenge trolling just caused a lot of collateral damage
0.0003605023427902324,My soul is weary of fighting the battles in this world BlackInAmerica WeAreNotSafe
0.0003604731020401487, since when the fuck can you not stand at a concert 
0.0003600593692649564,Prayers Protection to our brothers and sisters fighting in Charlotte rage against machines
0.0003600564584576812,Swear all of my guy friends are scaredy cats You don't do horror movies You don't do haunted houses Wtf do you do then
0.0003600128031051197,Forgot to plug the phone in overnight nightmare
0.0003599122030976261, it's Cannot DM you as we don't follow each other Not such a  party fail letdown
0.00035990344714804414,     terrorist attack and terrorism already exists in the history of islam
0.00035984773436461583,  imagine being this stupid for trying to chirp because of some racist prick
0.0003597615707258593, so this houses will get into my instestines and scare my poop and I'll shit my pants
0.0003597046419443362,A 'nonpermissive environment' is also called a 'battleground'  MilSpeak 
0.00035966833069716935,  It's no secret personal dislike of Trump animosity has always been presentnow magnified with bigotryracism etc
0.00035959595444567466,ESPN just assumed I wanted their free magazines 
0.0003595600776481081,days onnever a fucking pen nffc bitter
0.00035944491082779914,beyond naming shaming  lies a vast space bw sanctions terror statev wait til Others impose itamp do not hv COURAGE ourselves
0.00035941015924904906,When will the weeks full of Mondays end 
0.0003592968821845965,  Classic SHITLIB bullshit Create a horrible problem and then 'discuss' how to solve it What a PIMP
0.0003592488774401855,  Likewise death cutting 
0.0003590496135781825,FosuMensa is having a nightmare minutes Difference between Premier League reserves and League is still wide
0.0003590132824005534, I've been disconnected whilst on holiday   _emoj_triumph_  but I don't move house until the 1st October   _emoj_thinking_face_ furious
0.0003585597410736757, tells me my order will ship on Sept arriving by Sept Today is the   _emoj_neutral_face_  lies terrible whereismyfurniture
0.0003585565168927208, A plus point she won't have to queue for the loos Any more plus points Nope can't think of any shocking sexism
0.00035854428820677325, those sparkling looks like a gay vampire   _emoj_grin_ 
0.0003584495692613851, the pout tips me over the edge I am most definitely AGIN Who the feic bakes with full make up and boots with heels
0.0003584264414887053,RE politicallycorrect BS   What if I am offended by your assumption the USA should change because you are a 'visitor' don't like it
0.000358379692738592,is it bad that kurt is literally me 
0.0003580809244830299,Are you lost in the fury fearing that you'll fail
0.0003580491025301171, thanks for getting back to me exemplary customer service for a loyal customer jk  residentadvisor poorservice
0.0003575552075191566, I'm surrounded by those Trump voters You're right it is fucking terrifying redstate despair
0.0003571035535954245,lost my day snapchat streak i'm done
0.0003570463037109563,Still salty about that fire alarm at 2am this morning
0.00035683985984372033, opened doors to terrorism and he will pay for it  
0.0003568096628326948, Bk to up top pack midfield Stifle any flair we possess kill any entertainers dull reshuffle predictable slow average
0.0003567951670440008,I am just so bitter today   _emoj_neutral_face_ 
0.0003565398216796947, since when the fuck can you not stand at a concert raging
0.0003564477472325184,Now that the n word is normalized by the media Just wow No words for this  No Words For  This Frog been boiling in the pot via media
0.0003563386298307252,Making that yearly transition from excited and hopeful college returner to sick and exhausted pessimist college
0.0003562659296808208,I just killed a spider so big it sprayed spider guts on me like a horror movie  ugh 
0.0003560865926195839, relentless echo chamber  negative comments with lots of reverb Typical bully behavior
0.00035605895949689353,It's always depressing to sort WordPress plugin recommendations not by 'best' but by 'least offensive in terms of premium features'
0.0003560570075413525,  It's Ms btw we were lied to by Remain dry your remainer tears Just accept you lost
0.00035586094501951685, AgreedSo tired of this nonsense  Soros must be elated
0.000355764536622374,First a coat Now a pair of sunglasses Next it'll be a limb lost
0.0003555921043352799, Canada should be a driving force of democracy freedom rights  instead we help dictator misogyny Sharia Islam terror polygamy
0.00035541074923304655, I think just becz u have so much terror in pak nd urself being  a leader u forgot d difference btw a leader nd terrorist 
0.0003553200746221281,Wee cunts playing chappy in my street got my shoes on so I can chase and scare the fuck out of them
0.00035512761566285317,How on earth can the projection of all that is good and happy and true in my soul be a poisonous fucking snake patronus adder offended
0.0003550618893182605, AND his momma was worse than Tony sopranos momma wow sad history major
0.00035501745463059305, just trying to go home tonight A run on 2nd and and a run on 3rd and That's what champs do sike losers 
0.00035496426930431977,   entire team from coaches on down played and coached scared from jumpstreet intimidated
0.00035490253843275014,Will I offend you if I am truthful but kind or will you see why  haikuchallenge offend
0.0003548796306074445, Democrats and their voters have zero tolerance for honesty They associate honesty with anger and hate
0.00035481667570695197,My study skills are terrible   _emoj_unamused_ 
0.00035475631722535906,Jesus wept Another RNS from rusty  quote 'Price sensitive news Price Sensitive news' etc etc The Ramping here is shocking
0.0003546202774627206,TerribleDebateQuestions Madame Secretary isn't it true that Russia is behind all terrorism
0.0003545055554982966,I think Paul is what's bitter not the pastry
0.0003539222083400267,and apparently he's supposed to have a Scottish accent I'm offended
0.0003537488956755663,Shame on you  showing an elephant being hunted and killed shocking
0.00035373022387984377,  clicked the wrong side was fuming   _emoj_sob_ 
0.0003536140371484291,Incredible that Nawaz Sharif said Pakistan is victim of terrorism talked abt development in Pak Incredible how he controlled his laughter
0.00035352983813226064, I asked for my parcel to be delivered to a pick up store not my address fuming poorcustomerservice
0.00035337534866799005,she's always so insensitive whenever i grieve idgi
0.00035320955426006384,People have the right to protest Not to loot riot terrorize Charlotte Violence Anarchy is unacceptable 
0.00035304145233011993,I am using twitter as a coping mechanism for raging out at this kid oops
0.0003528719744165079,NL's top bureaucrat is a director of a group formed to oppose NL's top megaproject nlpoli  never dull
0.0003527159159569063,   bully Bullshit fullofshit please take out the garbage
0.0003522439563889397,minutes with an incense and all I get is Rattatas   _emoj_joy_  PokemonGO
0.0003522299019920444,We floated like butterflies Now you sting like bees'
0.0003519897695824707, just finally started homefronttherevolution what did you all do the story and gameplay  wasteofmoney
0.0003516928169510618,If her legs aren't shaking you're not doing it right
0.0003513408275804167, yeah a terror packed terror supported speech
0.00035114863242453903, does being a bully make u feel like a bigman Cos it makes u a twat
0.00035112851916141663,Another grim compelling news report by  on the blockade of aid to the starving in Yemen BBC dosomethingpoliticans
0.0003507929331838101, a multimillionaire spoiled brat who gets In a self righteous huff bc his friend is Muslim is a non starter bye
0.0003504999023335016,  MSM relentlessly saying DT can't win to depress GOP turnout provide cover stolen election
0.0003502577815794531,  give me a smiling emoticon will ya i dont like the idea of you frowning gtlt
0.00035010323506863425, too grim too insanely determined to hurt you from
0.0003498145630605406,  Cancelling home Fibe Internet and TV this afternoon  as soon as I can arrange alternate Internet  fedup
0.00034974329466829407,Their engine runs on fuel called whining   U jst  hv 2b observant Har din Rona dhona complain  Happy news makes them unhappy 
0.0003496799170385783,the teams that face Barca and Bayern after a defeat are the ones who face the wrath
0.0003496779521043531, Aye There's a brief window in both morning and afternoon otherwise just horrific until late evening
0.00034946832184903356,and again dirty and  self loathing attitude  mope talking
0.0003493628575170873, The worst customer service and lack of professionalism from this service provider phoneprovider badbusiness terrible
0.00034925098202964234, Canada should be a driving force of democracy freedom rights  instead we help dictator misogyny Sharia Islam  polygamy
0.0003492081538852463, Why does talksport sound like it's being broadcasted from someone's basement terrible quality amateurs
0.0003490552591490217,The book im riteing about wots happond has made them moor angry but im not here to plese man or hide the eval deeds of some
0.00034891902739317464, negative campaign of doom and gloom don't win elections
0.00034888916858044226,my school photo is honestly horrid i look so ew  _emoj_sweat_smile_ 
0.0003488054451607362,Everyday gay panic is STUNNING I drew guy's att'n to it when he blocked up a toilet stall's cracks wpaper towels TOTAL INCOMPREHENSION
0.0003487216679362501, correction ppl Checked in Standing at the gate Flt took off without us 
0.00034857180858502196,testing angry
0.00034850260748124726,I'm so bored and fat and full and ridiculously overweight and rolls galore terrible
0.0003482360562371695,I polished my nails but can't find the polish remover It look like a 3yr old polished my nails lol horrible
0.000348066762776046, yup I feel dirty cheering
0.00034801117754594383,Early morning cheerfulness can be extremely obnoxious ALDUB62ndWeeksary
0.0003479340244819942,   don't ever compare those scrubs to benhe'll shake off your whole DL and throw a td
0.0003478353020431403, World knows Pakistan is an epicentre of terror The pakistan speech in UN has define their agenda
0.00034779437828605104, Hakyeon takes all the attention happily perching on Wonshik's shoulder to sulk when Jaehwan accidentally caused a tiny explosion
0.0003477370864666903,It's been a week of awful connectivity with  no service or only 4G is not what Im paying for unhappy poorservice
0.0003477333999767064,Although this war will be under the guise of combating terrorism it will in fact be a war against poverty ignorance and just stupidity
0.00034739447021116666,eun im really unhappy with this and i dont like her like that pls dont  yall okay but SHE loves HIM
0.00034736406869102077,Scorpio always seek revenge
0.000347337018417109, dilemma blaiming everything on the Bushes but acting gleeful over their endorsement Election2016 Trump
0.00034733571194409753,Fake people irritate me
0.00034722821983531585, never thought an angry oompa loompa would be my Boggart but there you have it boggart PresidentTrump nightmare
0.00034720345879866906,  I hate winter I dread it's arrival
0.0003468749193624345,     Wrongdoing  Grrr  After the fact I know but emailing displeasure now anyway 
0.00034684317387517223,Dates in the glove box' is pure panic excuse GBBO
0.0003464052275409164,Boycotting  till butter pecan comes back I am furious
