rank,Tweet
0.0016177003138966044,TGIF Hope everyone that needs to find recovery can and that our friends stay sober this weekend  
0.0016174815821634778,Chris would take full responsibility and would want us all to rejoice in the memories we all had with him
0.0016171516741617263, second artist announcement looking good bluesfest2017  Music byronbay
0.0016170875848385787,   We're the least known band in the World but so glad you asked muchlove 
0.0016168536437580778,  awe I love you twooo come adventure with me someday
0.0016162233552212734, I don't like the statement but I love the optimism
0.0016158386677094685,The current run of superman continues to be a delight You can feel the love poured into it by everone on the creative team superman
0.0016146689440149787,Wishing a very Happy Birthday to our awesome dancer Ruthann We hope your day is magical bday happy eatcake
0.0016142226201347888, happy birthdayyyyyy pretty Miss you
0.0016132447964677982,  I would always be honest but it's great to feedback opinion to the brand  don't want to offend them BlogHour
0.001609912876158956,one of the main things im doing w 13c is filling in the void of my empty bitter heart by making everything how i wanted it to be growing up
0.0016094184533613166,LOVE LOVE LOVE  fun relaxationiskey
0.0016085587965488225,Lady gaga fucking followed i have been waiting for this day for ages it fucking happened im shaking thank you so much    _emoj_heart_  ufe0f
0.001607112517872416,the Lord turn his face toward you and give you peace Numbers truth trust promise calm justice great mighty protected delight
0.0016051613899819282,Thinking about trying some comedy on youtube Always been fond of it Time to nut up  comedy maybeoneday hopefullyfunny LOL
0.0016036492031478544,Leon's cheerfulness is always a big help
0.0016022183363174742, It's not just a treat for viewers to watch u as janak it's simply a treat for our soul mind thoughts hearty respect   _emoj_pray_   _emoj_pray_ 
0.0016015285685650658, thanks for replying I'm ironing my shirt  _emoj_joy_  I'd love to meet you and get an autograph but sadly I'm too young to travel
0.0016000499852063346,watching my first Cage of Death and my word this is tremendous
0.0015981706350820708,Mon Celtic give us something to cheer  place is empty soaked its my wee nephew's Birthday ffs started well now dropped off
0.0015978489658566679,you know it's beauty when the smile is her best curve
0.0015977931770403272, it's great to see Matilda so happy in her new chair it will provide her with access to lots of new experiences 
0.0015974461576154424,  You two are TEN TIMES more interesting than those particular afternoon goofballs I could say worse 
0.0015973840027917428,Vacation wise Egypt offers great places amazing scenery bright skies and good weather at a very good and affordable price for students
0.0015967934249953243,  had more fun than the funniest person in funsville Much hilarity as usual Thank you   _emoj_heart_  ufe0f
0.001596246803333892,Go follow beautiful Snowgang   _emoj_heart_    _emoj_heart_  Princess fitness bodyposi haircut smile Whitegirlwednesday
0.0015954928759298306,I love to laugh and share laughter as way to share joy
0.0015948851624305123,Sometimes I can't believe I've made it this far169 days I threw out my demons n got sober clean n started recoverySobriety is
0.0015947993621786593,Fun pizza night last night with the  crew What a gorgeous bunch of newbies   _emoj_heart_  ufe0f lively exciting   _emoj_muscle_   _emoj_fitzpatrick_type_3
0.001594381101575465,I absolutely love having an anxiety attack halfway through a family meal
0.0015943116536470449,I'm such a fan of endless laughter with friends and enjoying happiness together FridayFeeling weekend
0.0015918303467402227,Good morning Welcome the new day into your life and your heart mindfulness  zen
0.0015910891697129244,I love when girls are busy in teaching how to pout while taking selfie in a mall  their desication is immense women love perfection
0.001590389346871869,Love your new show  
0.0015899011371234399, ill be there with VIP TICKETS Can't wait to meet you Never met a famous person i admire before nervous
0.0015898014603987058,The LORD your God is in your midst a warrior bringing victory He will create calm with his love he will rejoice over you with singing
0.0015897277700298983,Love your new show   hilarious
0.0015887295412955393, hi little late to lost girl but think you awesome from South Afrikaans
0.0015874790573423743,terribledebatequestions has given me so many laughs this afternoon Thanks Twitter hilarious cleverpeople
0.0015873003784248857, I've got coming back this week It's so joyous isn't it haha
0.0015862775227612732,Thorpe park fright night booked for me and   21st something different should be a laugh   _emoj_bee_ 
0.0015847453972880619,tones    of my favourite chris pine stans i love tones more than anything mt sweet summer child i will attack anyone who hurts her
0.0015815678656589292,Accept challenges in life so that you may feel the exhilaration of victory
0.0015809710037797949,Modern family never fails to cheer me up Especially Phil
0.0015809538654658279,Cmon blues we are home games away from another CC semi  I love those Wembley away days Being on anyone at home please   _emoj_soccer_ball_ 
0.0015804292833226012, The Haunting is my favorite horror movie too Actually one of my favorite movies of all time no matter the genre
0.0015796117043385398,Finn singing 'Can't Fight This Feeling' in the shower and Will spying on him is one of the best scenes on any show glee
0.001577707378348718,  Crushes are for kids Just like trix  How bout some full blown up Love that makes you quiver deep down into your core Y E S 
0.0015765874778320224, love new movie  BlairWitch blairwitchproject  HorrorMovies
0.001576346578481781,I turn in two weeks I am so happy was my darkest year yet I am elated that I survived
0.0015755610906415542, the red one would look super pretty with a bronzy glowy nude lip makeup look 3rd black would be pretty with a dark lip   _emoj_heart_eyes_ 
0.0015745411776192037,Not the best horror ever but I like that the uncertainty
0.0015743594022416686, I   _emoj_heart_  ufe0fyou on DWTS You make my night every show   _emoj_blowing_kiss_  hilarious
0.0015742221098978568,Not untill today has anyone ever said to me they remember what I had on over years ago when they met me n liked me since cutealert 
0.0015740479066102457,      took its first baby  step now let's hope they will start running
0.0015731039755184173,I just heard the most incredibly transcendent song ever now I feel high fucked up yet joyful I will never be the same
0.0015715709516370983, May I send you a copy of HeroTheGreyhound Either ebook or real paper one A boy and a greyhound smiles tears laughter
0.0015705270544275117,You ever just be really irritated with someone u love it's like god damn ur makin me angry but I love u so I forgive u but I'm angry
0.0015703530951704534,If you want others to be happy practice compassion If you want to be happy practice compassion' Dalai Lama
0.0015697846931840846, this one was Apples attempt to make muslims happy  u0001f54b
0.0015693289697975576, I love how playful you guys are becoming  both on and offline   _emoj_red_car_    _emoj_taxi_    _emoj_blue_car_  beepbeep
0.0015684272201376402,Good CX most often doesn't require all that much smile care relate and be helpful Thanks Lakis Court Hotel in cyprus
0.0015681455273750238,  but be a little playful   He hesitantly pulls away just enough so he could get words out lips brushing against 
0.0015674595258110121,I love when  angry tweets bc it makes me laugh but also hate it bc it makes me miss her more
0.0015668811070570802,Wishing a very Happy Birthday to our awesome dancer Ruthann We hope your day is magical bday  eatcake
0.001564613046808932,Like I said   _emoj_black_rightward_arrow_  there's plenty of cheddar in the cheese to go around For everyone   _emoj_white_smiling_face_  
0.0015637544813744185,And girl I love your perfume there's something bout you   _emoj_headphones_  
0.0015623021230566439, yeah  playing well 
0.0015608565255963113,Bet pawpaw is having a good time rejoicing up in heaven for his first birthday there
0.0015580816151828652, I still find you pleasing
0.0015574301643312522,I just want to say social media isn't here to bully that has to be stopbullying  Please be kind to eaxh other lovewins
0.00155517399979524,Watch this amazing lively broadcast by peterson lively musically   Come WATCH
0.0015537738127222322,Ready for my sweet princess to arrive I'll he weeks this Saturday excited nervous
0.0015529375423013407, You make the world a more joyful place TheNiceBot
0.0015526802072278354,The sober equivalent of being in a bar women's restroom is the salon Everyone compliments each other become friends I love it
0.0015523319321491056, I   _emoj_heart_  ufe0fyou on DWTS You make my night every show   _emoj_blowing_kiss_  
0.0015516268876152757,Something about these cool breezy fall days   _emoj_heart_eyes_   _emoj_fallen_leaf_   _emoj_ear_of_rice_   _emoj_maple_leaf_ 
0.0015506099029751917,I just got asked to hoco over instagram dm bc someone lost a bet Love the maturity of the people in my grade
0.001550475486211601, go check up with your bf He'll give u strength with just one smile TOPno1
0.0015502624936699367,Everyday I wake up a different  player signs a contract extension Love it future is bright COYS
0.001549627021665627, awe I love you kid
0.0015493615638406178,i started glee from the beginning n i'm crying they were such babies i love my children
0.0015487798285835149, You are beyond wonderful  Your singing prowess is phenomenal but damn I'm just elated to watch you act again ThisIsUs   _emoj_hugging_face_
0.001548586285167088,   because distrust in life  Argentina has a lot of heart and this President is worth every vote
0.0015483524707379194,Needed levity Hubs  I talking of  Kyle's new solo album my yo says '' She loves ur news show 9News  LOLZ
0.0015464097374547538,Girlfriends cooking me dinner again spag blow it is not to sure if she need my help   _emoj_joy_   _emoj_joy_  girlfriends happy
0.0015462789757021112,And girl I love your perfume there's something bout you   _emoj_headphones_  breezy
0.0015462637984278288,Love this Laughing while crying works too katherinemansfield failure laughter dealingwithfailure
0.0015462004638014451,Could not be happier happy
0.0015455484823225145,SO many great pics from the show in Tokyo  _emoj_heart_eyes_  I like all his outfits now except the lace one w those horrible pants  _emoj_information_desk_person_ 
0.0015445437902505616,promise of restoration to the nation of israel'everywhere you look blessing 'barnswine overflowEverything beautiful joyful do_u_see
0.0015415175635874637,Had a great time at Skywalkers open gym tonight Come our every Wednesday from in Hillsboro and train with us opengym  tumbling
0.0015401700876848774,days until GoPackGo and days until GoGipeGo I'm so excited smiling
0.0015401194705118664,HUGE CONGRATULATIONS TO NICOLE WINNING BIG BROTHER  BB18 sorry not sorry  bbmichelle
0.0015398688963976551,Just want to be a dad so i can play kick the baby with my little one southpark mellogang ghastly edm plur dad djlife dj producer
0.0015395044890890834, im love you even if you bully me sadly
0.001539069209255885,I like the commercial where  on a chocolate milk bender steals a soccer ball from some guys and refuses to give it back 
0.001537382931395742, AWH tiff you're such a great friend I love you  thank you
0.0015373528143647612, THANK YOU FOR MY OBAMA CUT OUT I am elated that he's back home  _emoj_heart_eyes_ 
0.0015369285761236645,Ryan Gosling and Eva Mendes finally   B joyful an funnydont bossdont arguedo everything with kidsgo on mini car trips focus on love
0.0015360482469101524, My heart because you left me for so long again  slight pout but it turned to a smile  heheh just kidding no I'm fine
0.001533782510658007,i love the word fret so much and im in heaven
0.0015328636290923739,It's the FirstDayofFall and I'm so happy Sipping my PumpkinSpice flavored coffee and smiling Happy Fall everyone amwriting
0.0015313753650436335, awe thanks Couldn't be doing it without all your help and support and that amazing encouragement  _emoj_heart__emoj_heart_   _emoj_blowing_kiss_   _emoj_raised_hands_   _emoj_fitzpatrick_type_1_2_
0.0015313587495745836, I love parody accounts Well done Vote for Trump lol hilarious
0.0015303376984942406,  wow not heard this in forever Random but great  xph
0.0015270974666705445,I believe women are more fiery because once a month they go through struggle and struggle is what develops a strong character
0.0015270278110309655, my adorable and cheerful daughter Always pouring positivity green goo on me dare hurt her and you'll see hell growls  PandaBot
0.0015268939332055871,Ready for my sweet princess to arrive I'll he weeks this Saturday excited 
0.001526530112331398,Aw there's a young fox outside on the grass just jumping around all playful and having a little stretch   _emoj_see_no_evil_  soo cute   _emoj_wolf_ 
0.0015254891042693554,Love is when all your happiness and all your sadness and all your feelings are dependent on another person
0.0015242174556690424,The book that can start improving your relationship tonight  Taking you on a journey of fun laughter romance and metaphysics  htt 
0.001523981055680277,I wish there were unlimited glee episodes so I could watch them forever gleegoodbye
0.001523906549045084,If you love singing but don't have time for a weekly choir come down to KWOIR at  tomorrow Choir  musiclondon
0.0015237984683521971,Are you serious that fredsirieix lives in PeckhamSouth London's own Love Gurubig up
0.0015236111399007301,Loving   talk challenge  map inspiration stayunstoppable
0.0015232915344753066,Love how cheerful that woman is about storing someone else's furniture for an eternity I'd have sold it by now GrandDesigns
0.0015232498042359237,I love when my dog is playful but he really just scratched my face while flailing his paws in excitement and almost tore my nose ring out
0.0015231107978097035, love it so true As  taught me fear can be an illusion coaching  courage
0.0015230353748930676,At the regular cheerfulness of any emotion her own supper and to give the ladies were soon as they have been entirely at
0.0015220788998761242,I've watched ' 2nd Season's 1st episode twice already And here I am still joyful planning on watching it again
0.0015220602408719842, awe thank you so much Lyle You're the best  _emoj_grinning_   _emoj_grinning_ 
0.0015203222955080485,my mom recorded nightmare before Christmas for me   _emoj_heart_eyes_   _emoj_heart_eyes_   _emoj_heart_eyes_  I LOVE IT   _emoj_heart__emoj_heart_ 
0.0015202364583847688, True We were rejoicing the fact that we signed a quality young CB but we need one more at least   mebbe P
0.0015192568202270639, How cool would it be if  animated the scene
0.0015168253081177202,  that's so pretty I love the sky in the background and the purple highlights with the dull colors is great
0.0015159599094570215,Every dancers dream song snap worldpower
0.001515375724954323, just sitting close to him for an extended period of time was exhilarating because he's so beautiful and lively lol
0.0015142106184896247,My encouragement today is my dog while my head is in a fog epicfail depression feelingfedup tired ihaveheardeverything wondering
0.001514176831133982,Recording some more FNAF and had to FaceTime my mum to let her know I was okay after I let out a high pitched scream   _emoj_joy_   suchagirl
0.0015131028805584034,wants body to look a certain way eats cookies mac n cheese kitchen sink and small neighbor child
0.0015124093407915217,I'm absolutely in love with Laurie Hernandez she's so adorable and is always so cheerful
0.0015120193659291562,You have to find a way to top yourself glee
0.0015112019253245743, brings back great memories of hilarity on SATURDAYNIGHTLIVE
0.0015108093440217522,After soul searching I'd like to announce that I've chosen   to be my adopted sisters due to their hilarity
0.0015107723124904073, lowkey I want to go just to chirp Anna LOL but say hi to Atkins for me One of my favourite coaches he's smart and caring
0.001509712892149299, that i dont mind too much smoother thicker texture makes it more hearty also im glad iced coffee is a thing in the uk now
0.0015090519469170473,Go follow beautiful Snowgang   _emoj_heart_    _emoj_heart_  Princess fitness bodyposi haircut  Whitegirlwednesday
0.0015090049012131492,God's love springOf one dat sunk his whole estate for d paltry bribeof a single apple  _emoj_en_dash_ n yet proud of our ancestry  _emoj_heart_  ufe0f  _emoj_moyai_ 
0.0015057514539994906,whenever i pout i just want Adrian to appear and tell me to stop pouting or else
0.0015044833001668081,Everyday I wake up a different  player signs a contract extension Love it future is  COYS
0.001503738316409388, great minds think alike rejoice
0.0015037308950059088,this girl at my new school is so pretty i am 
0.0015029814957585503,If you love singing but don't have time for a weekly choir come down to KWOIR at  tomorrow Choir glee musiclondon
0.001502229310373997,These girls who are playful and childlike seem to have such lovely relationships Can't imagine them having serious convos but it's cute    _emoj_heart_eyes_   _emoj_heart_eyes_ 
0.0015011055375984243, loved sing tiff but q there is japanese line but obviously spoken by non japanese no way to find japanese for line
0.0014993560131173346, Thank u Justin for this amazing concert I can't believe that only u can provoke these thousand smiles these nightBelieveTour
0.001497532239997473, BIG thank you for liking my little Pumpkin    She's the smallest of my but is very playful wakes me up most mornings
0.0014947957306058219, you got this uf499 staystrong smile yourebeautiful
0.0014947957306058217, you got this  _emoj_heart_  staystrong smile yourebeautiful
0.0014945350281015133,love to play underlord while listening to cheery anime music
0.001493882895463854, i get the subway melt and make sure it's only hearty italian bread black olives are a must though
0.0014923634858663353, Miss Cookie sends her thanks She's not as spry as she used to be  like me She doesn't have the adventures the young pups do
0.0014919584380198919, Thank you for that the notification came in the nick of time to cheer me up  have to retweet
0.0014914757906834982, love new movie BlairWitch blairwitchproject horror HorrorMovies
0.0014905799076279126,someone teach me how to cheer someone up
0.0014892845326236804, wonderful experience watching you yesterday at  thankyou for the laughter
0.0014882929130839212,  i just read it and it's so fun So lighthearted and cheerful i was right it's a double cavity for me
0.001488039248933573,For a moment I found myself smiling
0.0014874951095358473,Df not be afraid to take a chance on peace to teach peace to live peacePeace will be the last wordvof history Pope John Paul II
0.001487333645436113,He maketh the barren woman to keep house to be a joyful mother of children Praise ye the Lord Psa1139
0.0014866180853347144, THANK YOU SO MUCH FOR COMING TO DETROIT I'm going to sob joyful rainbows now brb
0.001485597901724978,Stk is expensive but i'f rather take a bigger female there than tiff You all see how slim she is and how she loves to eat
0.0014838908424611337,She used to be beautiful but she lived her life too fast  Forest City Joe blues blinddogradio
0.0014824854719550674,CommunitySleepCoach Look at these narcoleptic puppies Make you smile If you are human find yourself in such odd positions seek th 
0.001482443664179001,For what a beautiful day elated
0.0014822781546895555,At school my classmate is with me at music class and he sang Hallelujah like god with my friend we were breathless
0.0014822326454329664,   _emoj_nerd_face_ dont be sad btw good night davinago sleep larh
0.0014802099885673884,im thoroughly in love w zen and jumin and i dont think id even have the patience for either of them irl im old and weary
0.001479021117429734,She gave a playful wink taking the goggles off her head swinging them around her finger 'I would never' 
0.0014786057342635905,When the sadness leaves you broken in your bed I will hold you in the depths of your despair and it's all in the name of love   _emoj_notes_ 
0.001476708278301446, I've joined holidog paw shake and tailster and have one regular customer I just love it   _emoj_see_no_evil_   _emoj_see_no_evil_  haha  
0.001476547538138471,semores let's get this mirth SAW keepthetradition   _emoj_heart_   _emoj_heart_   _emoj_atom_symbol_  u0001f3f5  _emoj_grapes_   _emoj_lemon_   _emoj_blossom_   _emoj_baby_chick_   _emoj_hatched_chick_   _emoj_womans_clothes_   _emoj_smiling_imp_   _emoj_smiling_imp_   _emoj_space_invader_   _emoj_cheese_wedge_
0.0014761727775007094, awe thanks morgs love u lots girly   _emoj_heart_  ufe0f  _emoj_blush_   _emoj_heart_  ufe0f
0.0014757262112624588, thanks gen Love you miss you happy birthday natong duha   _emoj_cupid_   _emoj_cupid_ 
0.0014746902605206136, but still your my favorite person in DF besides grim
0.001473399294521952,I'm Black I read books pu my kids from school'My prayer is that u wl lv a long fulfilling joyous peaceful GODpleasing life
0.001469292663859238,I love this hearty negro laugh jade and  let out relochte   _emoj_joy_   _emoj_joy_ 
0.001468729124721384,I can't wait for you to listen to my new single 'Mystery' and my new album  _emoj_yum_   newmusic newsingle newalbum popmusic dark
0.001466672870835618, any team in the world would be totally elated to get to have you on it XD
0.0014660547018319349,Thanks to all the sober drivers The real winners of the night ClemvsGT
0.0014659938493014207, cheer cheer the red and white we are now off to grand final to win the fight Thanks 
0.0014652478425097731, Strongwomen terrify weakmen  don't let the bully wear you down Loving your consistency and truth in rough times Hang in there   _emoj_heart_  ufe0f
0.0014648484688319602,Beings in my physical reality are my reflection so me being always joyful extends to their lives
0.0014647063187245152, awe thanks girl   _emoj_blush_   _emoj_blush_ 
0.0014635747951134005, after such a heavy days this has given much needed levity Thanks bro
0.0014616627337049096,Can't start a good day without a cup of tea    tea  day goodday
0.0014609451430172618,FF  Love support always Eliza Neals ROCKS blues music friends   _emoj_sunglasses_   _emoj_guitar_ 
0.0014578986945608706, ya know I love ya man but TheGreenInferno really fucked with my headgiggledo it again epic  ineedtherapy
0.0014571210653490385, was joyous Worried I would be disappointed Most definitely was not chickflick giggles comethefuckonbridget
0.0014568703589241882, even when we're fighting I'm laughing I probably have serious ingrained issues  _emoj_joy_   _emoj_hugging_face_
0.0014556616852563864,Val got a little too big for her hiking boots with that bakewell the little terror GBBO
0.0014552934318786707, my kinda girl pleasing the dick right  _emoj_heart_eyes_   _emoj_smirk_ 
0.0014534364231099967,Thank you  for the balloons today smile goodday
0.0014527653296172022,It's the most magical time of the yearXmas party announced and the outrage commences Gotta love Silicon Valley millennials
0.0014523594418098947, she let out a playful gasp and slowly wrapped her arms around his neck kissing him back
0.0014520281682073937, wonderful experience watching you yesterday at  thankyou for the 
0.0014493198734730874,I'm still laughing 'Bitch took my pillow' line glee kurt
0.0014487959057633822,Watching driven by food and  going to Devon Ave to eat nihari makes me gleeful af
0.001448558442191601, only good thing in madden is DC
0.0014477005028910987,Vals always smiling I love it gbbo
0.001447442581624127,I'm really hitting all flavors of my sparkling water rap But you know what's tripping me out These half French and Spanish flavors
0.0014459685301775676,Happy Birthday shorty Stay fine stay breezy stay wavy    _emoj_blowing_kiss_ 
0.0014441445035789215,follow my girl tiff she only got followers  _emoj_heart_   _emoj_cupid_   _emoj_heart_   _emoj_cupid_   _emoj_cupid_  
0.0014391709928842293,Dolores' A thin lipped smile graced glossed lips as she let blues peer over at the woman ' A constant delight As always'
0.001438147608533613,ilofitt is laughter happiness spiritual mental physical pizza Just kidding about the pizza Work hard in all facets for a fitlife
0.0014370447151487234,Good luck to all FuryHaney players playing this weekend at the Future Stars showcase in Frisco Tx KGB Gtown 
0.0014367907502078731, just watched you on the great wall hilarious   _emoj_satisfied_ 
0.001436655160007186,Loving  Pitch so far    _emoj_hugging_face_  _emoj_hugging_face_  _emoj_hugging_face_    chills smiling
0.0014359180675870174, thanks for playing Crock Pot Going radio blog blues music indiemusic
0.0014354854428763055,Girlfriends cooking me dinner again spag blow it is not to sure if she need my help   _emoj_joy_   _emoj_joy_  girlfriends 
0.0014353255894235897, you got this  _emoj_heart_  staystrong  yourebeautiful
0.0014341730030584705, the Christmas episode genuinely had me in tears of laughter
0.0014313905716548476,  happy birthday jin young PrinceJinyoungDay  happyjinyoungday got7 happy birthday
0.001430965525485721, yeah dude Appreciate the support Notorious on ABC peep it grateful 
0.0014304492508624724,The labor of love is not cheap or inexpensive it's the time spent earning it lackadaisical dreamer
0.00143012647575013,angel delight is my everything
0.0014301118916113683,I've said it before and I'll say it again It's God All God Only God awe archippusawakening entirelybyhisgrace
0.001429118552541086,Lea doing a mini set tour of glee my heart just cried tears of happiness and sadness
0.0014265045639487513,I'm ever so cheerful
