rank,Tweet
0.0007597802075940499, cheer up luv your face is alot prettier when you're not frowning lt3
0.0007524860428916747,Only Geo is capable of cheering me up  _emoj_heart_  ufe0f  _emoj_heart_  ufe0f  _emoj_heart_  ufe0f
0.0007391954374433953, I've just found out it's Candice and not Candace She can pout all she likes for me   _emoj_heart_eyes_ 
0.0007285595534555322, the bantz are absolutely top notch inconsolable I was when I realised
0.0007182021655123715,  It's hilarious
0.0007129647360549604,I found marmite in Australia  
0.0006632210469093852,I gave up on the U20 Rugby bet on the Roosters cheering nrl
0.0006400779815313776,Damn gud premiere LethalWeaponfunny and 
0.00063404026810293,Why can't you just be mine forlorn
0.0006230743244848331,McDavid breakaway Lundqvist with a tremendous save
0.0006229423002803877,   my snap is andriaprebles   _emoj_heart_  ufe0f
0.0005706509572575312,     Very pleasing ty
0.0005680604628799607,     This is hilarious  Not a Freudian slip eh 
0.0005428848622225543,Yo gurls Dm for a tribute   _emoj_stuck_out_tongue_winking_eye_   _emoj_sweat_drops_  snapme dm nudes tribute cumtribute cock snap cum swallow
0.0005279198998205294, I'm cheery now   _emoj_blowing_kiss_   _emoj_wink_ 
0.0005194050494897591, breezy luvvvv
0.0004115223128552557, but it's so aesthetically pleasing omg
0.0003943083133841698, Yeah bro it eas hella exhilarating
0.0001980929673381551, he chirp
0.00010712008962468829,It's all about redwine and glee
8.036786422019095e-05,Some Erykah Badu to sedate me   _emoj_heart__emoj_heart_ 
