rank,Tweet
0.0014254332042642963, That's what we strive for Jamie Please don't hesitate to reach out if you have any questions along the way   _emoj_slightly_smiling_face_
0.0014243791075280526,Hearing your parent say they're proud of you elicits infinite waves of unconceivable glee
0.001421622829759986,A warm smile is the universal language of kindness William Arthur Ward love kindness
0.001419758817525885, thanks for distracting me from my paper to watch this hilarious video   _emoj_joy_ 
0.001417555157520767,Just love Matthew Parris Political rage is good
0.001417469401714792, bts'  ud654 uc591 uc5f0 ud654 trilogy MV is my all time fav  _emoj_raised_hands_  quite gloomy but beautiful as well  _emoj_sparkles_ 
0.0014162230552916368,Greatest sign of trust is me giving you my laptop or phone without hesitation
0.0014155604789111516,My  literally cracks me up when I see posts from years ago and later   _emoj_joy_  
0.0014140494652076856, Thankyou for unfailingly bringing so much joy into my life you incredibly talented maker of mirth
0.0014139894426996066,oow16 sting decent new song
0.0014139354156079695,Made my night that  Reid was included in tonight's hilarity Some of those points were brilliant Thanks 
0.00140732409627395,Watch this amazing lively broadcast by mila__  musically
0.0014073240749685044,Watch this amazing lively broadcast by   musically
0.0014073240749685042,Watch this amazing lively broadcast by   musically
0.0014073240749685042,Watch this amazing lively broadcast by   musically
0.001407324074968504,Watch this amazing lively broadcast by   musically
0.001407324074968504,Watch this amazing lively broadcast by   musically
0.001407324074968504,Watch this amazing lively broadcast by   musically
0.001407324074968504,Watch this amazing lively broadcast by   musically
0.0014048909537782896,Treat joy and laughter as a form of worship and spiritual warfare laughter live victory worship
0.0014046410729579824, I can be your wolf if you want Hihi breezy
0.0014031956956523303, well it was after my heyday too I'm afraid I was expecting 1st baby I reckon Now aged gulps I'm so old 
0.0014021669910077768,   then I look at you and we burst out laughing
0.0014020173652156058,I've said it before and I'll say it again It's God All God Only God  archippusawakening entirelybyhisgrace
0.001401985341073212,MeogysDailyVocabEnhancment Elation quality or state of being elated feeling or state of great joy or pride
0.0013988592681280245,Tonight's DragRace AllStars2 episode GAVE ME LIFE Yaassss queens teamalaska teamkatya  bwahaha
0.0013964486561655596,Treat joy and laughter as a form of worship and spiritual warfare  live victory worship
0.0013919735145469917,Listening to  at work is my slice of sunshine in this dreary cube world 9to5life
0.0013873911833247295,My siblings look all gangster I look all cheery   _emoj_sweat_smile_   _emoj_joy_ 
0.0013869826648912433,We worship at Your feet Where wrath and mercy meet And a guilty world is washed By love's pure stream  Graham Kendrick
0.0013828133571359529,I've been loving you too long OtisRedding blues
0.0013812165938851548, c You have my most heartfelt condolences I'm glad it passed with levity and love in it's heart
0.001381131778376124,TheNiceBot WSJNordics You make the world a more joyful place TheNiceBot MPN DemiLovato
0.0013806326014930885,Loved  independence msg on  be happy fulfilled within yourself positivity will flock to you happy independent
0.0013805033292250482,As I lost my heart to you there in the dark Underneath the stars   _emoj_headphones_ 
0.0013794059307390722,   My heart goes out to that woman for the indignity of what she is sitting through
0.0013784137449546542,Pops are joyless soulless toys which look nearly identical  They are the perfect expression of consumerism  'I enjoy this franchise'
0.001378212415993582, hubby Noah shares this somber thoughtful photo of his one and only Dami Ponytail standout highlights beautiful picture nice
0.00137715575147979, love the optimism BLUE MOON
0.001376492401695191,Keep smiling 
0.0013762673705482382,Literally feels sg to be happy with sam  _emoj_heart_eyes_ 
0.0013760750868042453,The weather changed from sunny and bright to gloomy just in time to match my afternoon mood   _emoj_unamused_ 
0.0013748116010774399,  Helluva lot more animated than they were for the actual game gtlt
0.0013747556815355737,Rec'd call 2day from Haitian church we started in Florida some 15yrs ago Preparing to acquire their own bldg Wanted me to know rejoicing
0.0013743878467467993,  we provide dignified and professional funerals at prices families can afford satisfied clients bright pig
0.0013742128327843318, You sound like my husband   he makes hotter and hotter sauce  the fiery torment brings him mouthjoy   _emoj_fire_ 
0.0013723278044906577, AWW I had a Maine Coon when I was little named Ted Eddy the Wonder Cat They're such good cats Very playful and sweet
0.0013722847685532532, 'the darkest of nights can be bright the solemn of faces lights up with a smile'  believe in me as I do in you
0.0013717156390667957,you make my heart shake bend and break'
0.0013704689041619492,Partners are willing to walk alongside you without being intimidated by you WhoIsIT Part2 RelationShift CLifeMacon
0.0013695644337398214,Happy Birthday Roy Buchanan born on this day in roybuchanan guitar blues happybrithday
0.0013661253828917152,Research has determined of laughter is actually 
0.0013625931947611831,ari looks hilarious oh my g d this is too much
0.0013616482606989414,Watch this amazing lively broadcast by mila__ lively musically
0.00136164820292633,Watch this amazing lively broadcast by  lively musically
0.00136164820292633,Watch this amazing lively broadcast by  lively musically
0.0013616482029263296,Watch this amazing lively broadcast by  lively musically
0.0013616482029263296,Watch this amazing lively broadcast by  lively musically
0.0013616482029263292,Watch this amazing lively broadcast by  lively musically
0.0013616482029263283,Watch this amazing lively broadcast by  lively musically
0.0013616482029263283,Watch this amazing lively broadcast by  lively musically
0.0013602813014974803, ha freshers blues would love to re do all again  ha nice tshirt  vote for Pedro
0.001356684475435111,Happy Birthday   cheerchick jeep jeepgirl IDriveAJeep jeepjeep Cheer
0.0013548014256136596,  Hey Michael Thanks for following up yeah I think you'd be a terrific contrib Looping in assoc ed Juliana
0.00135461339723276,   She held the back of his skull smiling into the kiss
0.0013540723819836413,i love that tay tiff are just sitting at my house while i'm at work   _emoj_upside_down_face_
0.0013532901197932919,O you who have believed fear Allah and believe in His Messenger He will then give you a double portion of His mercy' Quran
0.0013517970264246052,Awareness of time is awareness of time lost awareness time 
0.0013471419243965815,Loving  Pitch so far    _emoj_hugging_face_  _emoj_hugging_face_  _emoj_hugging_face_   chills 
0.0013465698610687293,Every Wednesday I like to visit the inmates at Arkham Deliver a fruit basket And a cheery bouquet of enhanced interrogation
0.0013463178186316736,And thus begins my week holiday   _emoj_smirk_   _emoj_smirk_   holiday  ghastinoir rest
0.0013436565080022069,Luke He will be a joy and delight to you and many will rejoice because of his birth
0.0013429315533566013,Proud of you for overcoming your fear of deep water 
0.0013404200186568353,terror  i love you
0.0013392912607315165,Watch this amazing lively broadcast by mae lively musically
0.001338554515153919,aaahhhh a little  to soothe the soul music 
0.0013366148694644781,  also a delight
0.0013320369375666075, yes   _emoj_heart_  ufe0f  _emoj_heart_  ufe0f cheering homecoming game
0.001331909648675312,some say my lover is a pale green light he hovers high where the moon shines bright
0.0013297262838223337,This is a terrific universitya unique universityAthabasca University has become a part of my head a part of my heart' Peter MacKinnon
0.0013289756712668074,Happy Birthday  cheer cheerchick jeep jeepgirl IDriveAJeep jeepjeep Cheer
0.001328321561373989,OMG NOL i love u so so much i love ur cheery face and hugs   _emoj_blowing_kiss_   _emoj_blowing_kiss_   _emoj_blowing_kiss_  
0.001323683521059208,Paul forever Paul should have won Paul played such a better game BB18 
0.0013215253380780307,Pregame nerves have settled in   _emoj_scream_  i'l be cheering from home guys   _emoj_red_circle_   _emoj_medium_white_circle_  ufe0f  _emoj_raised_hands_   _emoj_fitzpatrick_type_1_2_  _emoj_rugby_football_  AFLCatsSwans ProudlySydney goswans  
0.0013208377307832393, He's flushed upon hearing the feeling is reciprocated He's elated to shove himself right into his arms and hug him tightly
0.0013196166512886782,Ellie just gave me loads of gifts with notes on em for uni n I burst out in tears I LOVE HER  _emoj_weary_ 
0.001318323662430841,  happy birthday jin young PrinceJinyoungDay happyjinyoungday got7  birthday
0.0013175238132862074,Currently listening to    podcasts Can you guys please move to yvr  hilarious missyou
0.0013132062908708185,Why have I only just started watching glee this week I am now addicted   _emoj_face_with_rolling_eyes_  GLEEK
0.0013111867911608753,You're so cute  truelove hilarious  beautiful graceful never heard explicits spoken with such elegance Mingo
0.0013101112147465598, I love Lizzy Warren's latest rage against Wall Street
0.001309973447376832, best segment so far by    hilarity
0.0013088227113840062,   Easy breezy beautiful
0.001306741400871094,Swear I got the most playful ass bf ever   _emoj_joy_   _emoj_face_with_rolling_eyes_
0.0013066621215248662,When my friends send me ballons and fireworks through text amazing 
0.0013040544413503946,Back to forest drama  from my Forest music  series nature dark art photography Finland
0.0013028655984464014,  thanks for sharing Surprise guests  visiting US Tenor Sax  livemusic capetown blues
0.0012979226489536534, Oh FANTASTIC I bet it was super exhilarating    _emoj_hugging_face_  _emoj_heart_eyes_ 
0.001297686305683633,It's so breezy I love it   _emoj_wind_blowing_face_ ufe0f  _emoj_leaves_   _emoj_heart_ 
0.001290195799653713, sadly beautiful photo
0.0012898303669932163,When you forget to mention you were bought dreamboys tickets   _emoj_face_with_rolling_eyes_  _emoj_joy_  
0.0012890168854441245, can't stop smiling   _emoj_satisfied_   _emoj_satisfied_   _emoj_satisfied_ 
0.0012866611626066525,Rewatching 'Raising Hope' with hubs this time and totally forgot how hilarious it is   _emoj_joy_  HereWeGo
0.0012808154082593248,Happy Birthday to my favorite author  horror writer author
0.0012804961176090274, Her cheerful voice echoed through the grand familiar home a smile blossoming on my rosy brims 'Mom' I reciprocated the 
0.001280273002897148,Follow up Follow through Be  success
0.001277844419273407,also other ppl who i love a whole damn lot erica joanna tiff sirli harley anja the rest of the gc bc i ran out of chara
0.0012770353731434924,gloomy weather puts me in the best mood
0.0012718771041810171,The cure for anxiety is an intimate relationship with Christ  John 
0.0012694785195007737,Love how Megan is raging about this Kendall Jenner photo and I'm sat here like   _emoj_thinking_face_  _emoj_upside_down_face_
0.00126930245939506,One of my favorite classic cars is the Plymouth fiery
0.001266819624099258, 'El' He turned around to her smiling before hugging her gently
0.0012655438086099171,Nothing lovelier than your great mate sending the most joyful and sweet pic  Thankyou amy  XXXX
0.0012648636271461648,in geometry today hannah started crying of laughter because ms canning said 'pp' lol
0.0012647559645583243,Kinda wished I watched mischievous kiss before playful kiss
0.0012623635983727165,They used to laugh at her coz she couldn't afford a junky now they stare in awe while she is winning
0.0012620214645639673,   Sorry for the levity if at all inappropriate but this combined with my love of Charlotte reminds me rn
0.0012617427658454543,nana hoco bc my dream since freshman year awe   _emoj_kissing_smiling_eyes_   _emoj_heart_   _emoj_heart_   _emoj_heart_  
0.0012596117162190811,With loyal heart is concerned somber
0.0012585924636616553,You make me breathless
0.0012565810534945867,Lucina that's fantastic When you feel cheery we ALL feel cheery
0.0012557984058437766,  im so exited I am shaking so much   _emoj_heart_eyes_   _emoj_heart_eyes_  and im so pround of Colleen and the fandom Everyone is amazing   _emoj_heart_eyes_ 
0.0012548852583432564,Jay Z and Brad Pitt cheated Bey stayed Angie left cheaters love lust sex couples relationships date marriage divorce
0.001253630578290849, you look adorable awe
0.00125277292735132,When we give cheerfully and accept gratefully everyone is blessed xbbMaya Angelou
0.0012513506111277355,Loved  independence msg on  be happy fulfilled within yourself positivity will flock to you  independent
0.0012506410288328422,Happy Birthday to my favorite author   writer author
0.0012493746784373635, can't wait to see you Hun cuddles gossip laughter
0.0012465313911771082,You sting like a bee but you're still my honey
0.0012464006093514286,So I'm not being shady but one of Jongdae's ex rumoured girlfriends is going on WGM I'm not saying I'm over joyed but I'm over joyed 
0.0012453082262656155,I be trying to not stay playing madden and 2k but its just so addictive   _emoj_sob_   _emoj_sob_ 
0.0012440586898352652, I had a nice Italian icecream whilst resting my tired paws Honey flavoured naturally FurryTails lost Venice
0.001241193918450958,David Gilmour's biggest compliment BB King asked him after a gig if he was born in Mississippi pinkfloyd theblues davidgilmour blues
0.001240426252425012,sav tells our mom 'I love you' and she responds 'Oh' 
0.0012385497176679615,why do i have such a thing for dark curly hAIR
0.0012375185164905371, i'm elated thank you for your help can i apply to be verified
0.0012340828197536186,Prayers Protection to our brothers and sisters fighting in Charlotte  against machines
0.0012305069509624279,Eve Izzy and Paige cheerfully sing songs together
0.0012197827717423905,It's meant to be  
0.0012182886173720971,It's a beautiful day today Cloudy but sunny and breezy
0.0012175732440836843,And you as well sparkling      
0.0012135801499248268,Why have I only just started watching glee this week I am now addicted   _emoj_face_with_rolling_eyes_ glee GLEEK
0.0012079572135609907,Icon is pochama He is very cute and easily elated
0.001205879289305923,Ughhh love a clean house and my incense lit aromatherapy
0.0012058694185301745, i like cold gloomy weather
0.0012054812244821735,It's not that the man did not know how to juggle he just didn't have the balls to do it  funny pun lol  punny
0.0012054811911167275,It's not that the man did not know how to juggle he just didn't have the balls to do it  funny pun punny  lol
0.0012044541987796817,Zeph 'The Lordis in your midst a mighty one who will save He will rejoice over you with gladness He will quiet you by his love'
0.0011996284261492273,It's not that the man did not know how to juggle he just didn't have the balls to do it  funny pun punny lol hilarious
0.0011970518932936838,When my friends send me ballons and fireworks through textamazing smiling
0.0011969689052114773,i've been rooting for him since the beginning  BB18
0.0011916724794198928, salaams ma'am how r u ma'am May ALLAH protect u from sadness illness harm nazrebad AAMEEN Stay Blessed ma'am
0.001191417655140962,Folk Band 'Thistle Down' will be replaced by 'The Paul Edwards Quartet' at Laurel Bank Park Sat 11am  3pm due to ill health jazz 
0.0011904180895581536,noah fence but i want a harley quinn or blake lively layout
0.001185724225684399,Winlose or draw vs LFC all football fans will rejoice as West Ham Chelsea fans beat the shit out of each other in a council house COYS
0.0011794416320637553,A hearty welcome to those who followed me
0.0011765996310326345,I found marmite in Australia  happy
0.001176366335547623, Ah the Grand Old Paradox that is fearing the encroachment of the state but loving unconditionally its paid enforcers
0.0011748855728947044,her fingers slide along your thighs caressing the skin before she's leaning down down down and the first lick is teasing n playful
0.0011742091578319626, that's me all the time I carry ginger candy peppermint oil and seabands at all times 
0.0011698713869340662,I need a   _emoj_bento_  sushi date  _emoj_rice_ball_     _emoj_spaghetti_  an olive guarded date  _emoj_cheese_wedge_  and a   _emoj_facepunch_   _emoj_fitzpatrick_type_3 Rockys date  _emoj_pizza_  
0.0011566633528793716,  ditto Such an amazing atmosphere PhilippPlein cheerleaders stunt LondonEvents cheer
0.0011529644853842205, awe isa love u hoe thanks
0.001150736882848851, can't wait to see you Hun cuddles gossip 
0.0011497775266006052,The neighbor dancing in the Clayton Homes commercial is me 
0.001148162546244123,just waggled my eyebrows up and down at the baby and she burst out laughing i love her haha
0.0011477549663206005,All this from a cigarette burning in Laura's hand the angle of her chin the purse of her lips'104 Gorgeous transition
0.0011463436103136518,Just reached 10k followers  WOW  thanks blues mcfc ctid
0.0011455436862829594, hahaha and u da best bro ever luv u hearty hearts
0.0011448715350211125, it's being extremely playful
0.0011447473545943452, she was my favourite such a joyful soul
0.0011419828192554173,We are elated to have  Sid Espinosa and  ready to inspire innovative students    
0.0011387870539742596,My producer is mixing and mastering the songs now for murky notebook mixtape The tape will be out soon for free download   _emoj_fire_   _emoj_notes_   _emoj_dash_   _emoj_100_ 
0.001134475350180699,Thanks for making our Mass with Fr Vallely respectful meaningful and joyful    SeeWithEyesOfMercy
0.0011284098362524643,  must be rejoicing ovet Charlotte protests  NorthCarolina
0.0011281617324923113,  awe miss y'all too
0.0011273023600454374,RIP30 Heaven is rejoicing because they've gained an angel the Keifer family are in my prayers   _emoj_heart_   _emoj_pray_ 
0.001125834974263973, Grateful for novel award promo RT  Blessings DeWayne Hyatt Hippie who loves to grind on the blues Florida
0.0011255154384403907,Follow this amazing Australian author  fiction  zombies angels demons vampires werewolves follow authorlove
0.0011254463467022223, peers down at you eyes crinkling with mirth and affection I do love ye so my bonnie Belle
0.00112451729150181,  she's still younger and more spry than trump
0.001120523757965496,I am their fury I am their patience I am a conversation   _emoj_heart_   _emoj_heart_  ufe0f  _emoj_sparkles_ 
0.0011174460749286824,Queen Bey will be smiling over sixth this afternoon
0.0011165269385442222,Peter is aesthetically pleasing to look at
0.001113858703706622,smile instagramers  SelfieBestMeSelfieMeSmileBestMeCameraIsGreatEmojiGridLikeforLikeFriendGirlBoyTattoosFamily6PackG
0.0011130788161235379,Starting at minutes this week's  is straightup paradigm shift level mirth
0.0011111811862200385, he gives a gleeful squeak and wraps around you All mine
0.0011104238804620346,He replied to my comments times now i'm shaking omg
0.001107541972081456,I can literally eat creamy pesto pasta topped with grilled chicken sun dried tomatoes asparagus and pine nuts every single day of my life
0.0011042628439088562,Batman the animated series is a gift from the 90s animation gods
0.0011040654539518776,  Blew up the Internet with his chirp Lol Love it
0.001099809755951071,I need a   _emoj_bento_  sushi date  _emoj_rice_ball_     _emoj_spaghetti_  an olive guarded date  _emoj_cheese_wedge_  and a   _emoj_facepunch_   _emoj_fitzpatrick_type_3 Rockys date  _emoj_pizza_  tiff
0.0010932571016252152, It's a beautifully sincere balancing act of grief and hilarity
0.00109283623430988,Tiller and breezy should do a collab album Rapping and singing prolly be fire
0.0010836069991656942, He will rejoice over you with gladness  He will renew you with His love  He will rejoice over you with singing
0.0010813495240207735,Nawaz Sharif is getting more funnier than  day by day  challenge kashmir baloch
0.001080941878860991, Fear is bestbeast product of Gods  aTheism theism biBle afraid christianity hell heaven purgatory psychology jesus
0.0010804506206928378,When your rewatching glee and break down in tears all over again   _emoj_sob_   _emoj_cry_  glee
0.0010797822306769936,aliens zombie gore slash ghost sith horror I love it all   _emoj_hocho_ 
0.001075266439642417, happy birthday to my seed  _emoj_double_exclamation_mark_ ufe0f  _emoj_double_exclamation_mark_ ufe0f  _emoj_double_exclamation_mark_ ufe0f renewtherivalry imyourdaddy cantbeatme madden tater
0.0010709665704453498,    no wonder Kelvin and Chris are smiling   _emoj_heart_eyes_ 
0.0010698475565513866,  Who nose where those scent roses went To a spot in the Orient Mummified In rapeseed oil fried Eating drinking merriment
0.001065153671139062, Sweet optimism
0.001060068851738728,  ditto Such an amazing atmosphere PhilippPlein cheerleaders stunt LondonEvents 
0.0010568655191994431, happy birthday to my seed  _emoj_double_exclamation_mark_ ufe0f  _emoj_double_exclamation_mark_ ufe0f  _emoj_double_exclamation_mark_ ufe0f renewtherivalry imyourdaddy cantbeatme  tater
0.0010558298030710189,Skiving Freshers2016 for a me day nails sunbeds and gym   _emoj_wink_   _emoj_heart_   _emoj_crown_  priorities student studentnurse pampered 
0.0010528414031576636,A hearty Jonza to all my friends and follower
0.0010522470514088605, you are the best Whiney Jerkass Heel since 's heyday in WCW   LuchaUnderground
0.001042080628018399,it was both lively lovely    BuffnPolish
0.001041084886961533, happy bday bro   _emoj_ok_hand_   _emoj_fitzpatrick_type_1_2_
0.0010347630436868505,chirp chirp what a beautiful white and red bird   _emoj_bird_ 
0.001026083839471427,  this makes me giggle with glee
0.0010192710480935398,recession economic gloom The brightest stars shine in the darkest nights Our html5 webdesign rocks rtblitz finovate wlsb
0.0010191388227231565,in love with   insta hilarious
0.0010145038406658626,meeting tiff at the mall soon congrats on getting that L babes  _emoj_heavy_heart_exclamation_mark_ornament_ 
0.0010139231190218541,A joyous first webiversaryweb mitzvah to Smithsonian's      
0.0010079173976672248,Having holiday blues WantToGoBackToMinehead
0.0009994562115849522, I am sitting here wrapped in a fluffy blanket with incense burning listening to Bon Iver and drinking mulled wine I'm there
0.000996757239142791, bitter hahaha just kidding its crazy tho
0.0009918330706458402, Sweet 
0.0009795038779775243, I cried with laughter
0.000977386200898543, glee glee glee glee gLEE GLEE i LOST LOST LOST lowe much
0.0009751953206971061,  revolting cocks if you think I'm sexy
0.0009746146710636653,  _emoj_boom_   _emoj_scales_  ufe0fYeah  _emoj_double_exclamation_mark_ ufe0f PAUL  _emoj_double_exclamation_mark_ ufe0f  _emoj_scales_  ufe0f  _emoj_boom_   glorious BB18
0.0009699145593612495, easy breezy beautiful rasta mon
0.0009675401080205306,Miss my lil caramel delight   _emoj_heart_ 
0.0009659650751358404, cheer up chuck  _emoj_blowing_kiss_ 
0.0009627616156748149,in love with   insta 
0.0009558283845698342,jstor's lingua obscura articles are always such a delight
0.0009541952325368556, love that Jordy revenge   _emoj_soccer_ball_  ufe0f
0.0009513328579526654, I'm so gutted I loved her cheery disposition
0.0009483476073356687, Ciara asks was it a scifi movie Julie Jen just stare Claire on her phone Joey bolts when the cab honks LMAO 
0.0009479450668880793,Relive Vegas' heyday with Rat Pack tribute
0.0009452031655707174,Proverbs  Ointment and perfume rejoice the heart so doth the sweetness of a man's friend by hearty counsel TruthfmDawnBreak
0.000944679813995161,GBBO can cheer me up   _emoj_white_smiling_face_  ufe0f
0.0009446798139951607, cheer up  _emoj_white_smiling_face_  ufe0f
0.0009405462622570485,Fast and furious this Monday pm on mbc   _emoj_heart_eyes_   _emoj_heart_eyes_   _emoj_heart_eyes_   _emoj_heart_eyes_   _emoj_heart_eyes_   _emoj_heart_eyes_   _emoj_heart_eyes_ 
0.0009236402997409166,She'll be bribing her parents with hearty laughter and giggles  Loveet
0.0009223859704803559,Taurus females are beautiful sparkling jewels glowing in the moonlight
0.0009208763519652826, dhoni bcoz of is calmness nd match winning  finishers nd a proud miltirian dadhusband nd wonderful humanbeing nd his smile
0.0009168665113651629,Come to the  FUNdraiser this Fri at 8pm  Because pie  face  hilarity
0.0008979563309318751,  That is Noah Ark it's a terrific design
0.0008929667809502969,A cheerful heart is an unending banquet Proverbs Mishle
0.0008761485858941888, OMG that's such a beautiful quote breathless amwriting
0.0008680082993722033,  awe ain't he a sweetheart He's adorable   _emoj_blush_   _emoj_heart_eyes_   _emoj_heart_  ufe0f
0.000859888647822043,Lmboo  using my nephew for meme hilarious
0.0008399270731580509, plus a hearty pour of yachtrock by mustacheharbor 
0.0008384774588322359,Marcos Rojo Marcos Rojo running down the wing Loved by the blues feared by the reds
0.0008368333384685214,Add Donte Moncrief to my dismal situation blessed
0.0008194382391394455,I'm a cheery ghost
0.0008111014598496138, my heart did the flutter
0.0008098404981873367, awe that's adorable
0.000779921487738514,SIGUEMEYTESIGO happy snapchat Manuellynch99 venezuela
0.000779678949173396,Thursdays at 6pm Vespers Meditation prayerful plainsong multisensory candles incense psalms music silence faithful sing or listen
0.0007781353946069041,FF   Keep on smiling   
0.0007780867741013705,The Pats are awesome Belichick is awesome they just are awestruck
0.0007731141024354868,  cheering for  and 
0.0007652767141211243, dhoni bcoz of is calmness nd match winning  finishers nd a proud miltirian dadhusband nd wonderful humanbeing nd his 
