rank,Tweet
0.0018719805824387818, Good morning love Happy first day of fall Let's make some awesome autumnmemories annabailey laughter smile
0.0018367581169182535,Live simply Dream big Be grateful Give love Laugh lots  Unknown quote inspiration happy
0.00183362258214134, I hope you never go a day without something to make you smile You deserve all good things Please follow me   _emoj_heart_  ufe0f  _emoj_heart_   _emoj_heart_   _emoj_heart_   _emoj_heart_ 
0.001830346201169442, hello Miss Lady I'm sure today brings you happiness and laughter use your voice also to make us laugh  god knows we need it
0.0018263712329827453, Good morning love Happy first day of fall Let's make some awesome autumnmemories annabailey  
0.001820254710696453,I'll find Myself smiling and even laughing at jokes that I don't even think are particularly funny and I know it's because YOU love them
0.0018142009468543263, man GREAT JOB I am more than happy over your success in a short time  Mom dad are smiling from heaven  Love you bro
0.0018061665917189949,I love seeing happy women that glow is something real
0.0018029066441704114,Quote_Soup Be happy not because everything is good but because you can see the good side of everything 
0.001802906644170411,Followback Quote_Soup Be happy not because everything is good but because you can see the good side of everything 
0.0018005214225356601,Keep smiling because life is a beautiful thing and there's so much to smile about MarilynMonroe KeepSmiling
0.0017854010776546729,As much as I want a normal little life It wouldn't suit me I'd get restless I need to just do what I want at all times to be happy   _emoj_blush_ 
0.001784054948929408,Sometimes I get to sit back and be proud of myself for pleasing Him so well
0.0017839739061794356,You know you're in love when all you can do is smile whenever you talk about how he is to someone
0.001782109347874852,Hey u never know Channel 4's version of GBBO might actually be quite good A few adverts aren't the end of the world optimism
0.0017813310628949249, I really enjoyed both episodes I had a bit of a gloomy day today but I feel a sense of inspiration from listening
0.001779386132103987,This took a melancholy turn but my point is that for all the difficulties I'm still happy Happy that I get to be who I am
0.0017790266859241549,But I got to see her last when she was lively and talkative and I was able to tell her I loved her so that's what matters
0.001774510525921121,Always be cheerful smile often make others happy care for others help who feel helpless and vulnerable Life feels good leadership
0.001773521883240373,Ix92ve learnt that a smile and good morning goes a long way and saying thankyou goes even further  quote retweet inspire
0.0017712089710574632,You will never find someone who loved you like I did And that my love will be my revenge
0.0017708294415500706,I feel so blessed to work with the family that I nanny for   _emoj_heart_  ufe0f nothing but love appreciation makes me smile
0.001770828207989519,wanna always be the reason behind her happiness and i'll always keep her smiling no matter what happens  _emoj_aquarius_   _emoj_heart_  
0.0017669792872508738,I'm so playful lol I need somebody that'll joke with me all day long cause ill never get tired of it
0.001766100651075134,Happy internationaldayofpeace everyone hoping that the world becomes a better place less division more happiness keep smiling   _emoj_smile_   _emoj_smile_   _emoj_heart_  ufe0f
0.001765160932726994,The best part of this day Jesus is to snuggle up in your embraceto rest in your arms and know you love me  _emoj_heart_   _emoj_heart_  sweetEmbrace delight
0.001764300225525569,Love being made to feel bad about being scared of the dark
0.0017611796428562449,Focus on yourself Don't let other's love define you when you're happy and don't let it make you bitter if you get hurt
0.0017597761570907746,At the end of the day I know that my kids will never worry about me leaving them   _emoj_heart__emoj_heart_ 
0.0017588970756823488,If you have the ability to make someone happy or to make someone smile do it The world needs more of that right about now CreateLove   _emoj_white_smiling_face_  ufe0f
0.0017585690109742091,It's a good day at work when you get to shake Jim Lehrer's hand Thanks  Still kicking myself for being to shy to hug 
0.0017580195577406254,the thought of you gets me through my day the thought of your smile never fails at making me smile   _emoj_heart_ 
0.0017566053800418572,I love having such a big family There's never a dull moment in my house   _emoj_joy_ 
0.0017553354966922368, people have so much negativity filled inside them but im always happy that in such a gloomy world someone like u exists Namjoon
0.0017545277780024638,   _emoj_heart_  Heart so pure and smile so bright I love you more than the number of stars at night Kindly follow me please Harry  
0.001754086494890876,Oh goodness I'm loving this rainy  day It's a head down creative cap on get lost in your thoughts kind of day   _emoj_thought_balloon_    _emoj_white_smiling_face_  ufe0f art create biz
0.0017533458365400407,You dont have to feel grateful to be grateful for it is written  ' all things work together for good'  for those who love God cheerful
0.0017527837350139307,Use your smile to change the world Don't let the world change your smile' quote actorslife  love hardworkpaysoff fun
0.0017519646958385562, happppy happppyyyyyy happppppyyyyy haaapppyyyy birthday best friend Love you lots   _emoj_heart_   _emoj_heart_   _emoj_heart_   _emoj_heart_   _emoj_heart_   _emoj_heart_   _emoj_heart_   _emoj_tada_   _emoj_confetti_ball_  chapter22 bdaygirl happy love
0.0017499930048350074,Patti seems so sad She stamped and ran behind the sofa We will have to give her plenty of love and affectionmore than usual sad
0.0017476426564750306,I love Mary's undying optimism You could present her with dog shite and she'd find something good to say GBBO
0.0017471992100058162, you're the smile to my face and the beat to my heart Thanks for being kind as much as you can be Mind following me  _emoj_heart_ 
0.0017470369989728719,one month til someone's bday and i think it's time to flaunt that I got them something pretty awesome 
0.0017462076718153198,My bf drove out of his way after a long day just to spend min holding me to make me feel better How'd I get so lucky lucky happy
0.0017454952592205113,My morning started off amazing Hopefully the whole day is going as i want it to go  GreatDay 
0.0017442025747705602, I remember it well happy afraid Positive
0.0017433647620069335,To all who follow me whether we've ever talked or not hope you have a joyous life Goodbye
0.0017398472881186102, love you so much smile   _emoj_blush_   _emoj_blush_ 
0.0017391048179357129,Patti seems so sad She stamped and ran behind the sofa We will have to give her plenty of love and affectionmore than usual 
0.0017376840724244598,That was a lovely story to actually see Ruth and hubby who won the cashcow It was so funny when she left the phone happy   _emoj_blush_ 
0.0017338761212718709,  Thank you so much Gloria You're so sweet and thoughtful You just made my day more joyful I love you too   _emoj_blush_   _emoj_heart__emoj_heart_ 
0.001733446148685789, sadly i have to go to bed now don't announce anything while i'm gone thank u i love you
0.0017332361420005608,I'm so excited to see Nat tonight   _emoj_heart_eyes_   _emoj_heart_eyes_   And how happy and cheery she is then I'm even more excited for her to get on social media   _emoj_heart_eyes_  BB18
0.0017312405855132468,  So sadden  Spunky a beautiful dog A sad story a lovely happy An loved dog  Play little one have fun you are so loved
0.001731232496314282, i'm totally loving it it just makes me sad when people feel super awful cuz they aren't abroad like life is still goin
0.0017304634284540641,Nice to see Balotelli back to his best good player Just lost his way a bit
0.0017297170052488835,BridgetJonesBaby is the best thing I've seen in ages So funny I've missed Bridget love  TeamMark
0.0017290950023205577,Omg You've got to watch the new series 'This is Us'wow Best tv show I've seen in a long time tears laughter moretears
0.0017280595580836994, I remember it well happy  Positive
0.0017280575854269186,You dont have to feel grateful to be grateful for it is written  ' all things work together for good'  for those who love God 
0.0017262399493643834,  _emoj_sparkles_  you make me happy    _emoj_sparkles_ 
0.0017259617670800176,Absolutely can not believe the generosity pouring out for us but Id give everything I have for Nick to be healthy and happy lost
0.001724572441656556,Oh dear an evening of absolute hilarity I don't think I have laughed so much in a long time   _emoj_joy_ 
0.0017244093823397101,Boy oh boy our weekday schedule is crazy But no matter how tired I am I do whatever it takes to keep the smile on Kai's face from a frown
0.0017238352375977318,I had really strange and awful dreams last night I'd didn't even eat cheese before bed  lovemysleep
0.001723441135032849,I love my black people I really really do But  my people really do irritate the living hell outta me all cause I'm different   _emoj_expressionless_ 
0.0017228453479609615,There is something v satisfying about  opening an old 'to do'doc file and being able to check off all the things you have done smiling
0.0017225224342204443,Day of harvest16  listening to the sound of the chopper working it's way closer to home at  makes me happy farm365
0.001721444734509802,The best part of this day Jesus is to snuggle up in your embraceto rest in your arms and know you love me  _emoj_heart_   _emoj_heart_  sweetEmbrace 
0.001721028074572334,Cover it up with a smile maybe it'll get better
0.0017203986363047265,Decide to stop being afraid To just stop What are you now free to do  brave free honest healthy happy life living optimism love
0.0017194052213676642,one thing I can say is that you kept me smiling
0.001718295206324966,Final night shift coming up  I won't miss it but I will miss my work pals and the hysterical laughter that gets us through the night
0.0017179908852691936,Oii oiii     THANK YOU for always making me smile  MY BIRTHDAY is in days   _emoj_tada_  Mind following me as a gift    _emoj_gift_  X225884
0.0017163386814918664, Glad to see that you're having fun in the sun Water sports are always fun challenging and exhilarating happiness beauty
0.0017161170205367475,TheNiceBot IndyMN I thought the holidays could not get any more cheerful and then I met you TheNiceBot  u0627 u0644 u062e u0641 u062c u064a
0.0017161170136782066, I thought the holidays could not get any more cheerful and then I met you TheNiceBot
0.0017161152373760757,I love my family so much lucky grateful smartassfamily hilarious love
0.0017160711939386629,  Katie I love how you describe yourself as 'normal' Really you're anything but  neverchange
0.0017158046715042216,why is  so aesthetically pleasing every single day they're even pretty when they just woke up when they're tired just always
0.001713699494045792, I convinced my mom to watch it Killgrave gave her literal nightmares but watched last episode four times smile
0.0017124533982174203,Having a baby born too soon is lifechanging years on and it feels like only yesterday sad happy  emotionalrollercoaster
0.001711690987136666,Never let your fear decide your future   _emoj_person_raising_both_hands_up_  _emoj_fitzpatrick_type_4_ Have an amazing Thursday  Love Miss D X
0.0017113027551696211,I got so much fan's on here Y'all and vixx keep me smiling   _emoj_heart_   _emoj_heart_   _emoj_heart_ 
0.0017107629550874115,Home is where the heart lies  Love my little island but my birth city just ain't acting right im not feeling too good about it restless
0.001710682293633284,It's HobbitDay  Hobbit's give gifts on their birthdays so I'm sharing the gift of glee today Find something that makes you happy
0.0017098429030497494,My bf drove out of his way after a long day just to spend min holding me to make me feel better How'd I get so lucky lucky 
0.0017097497703883423,I love my family so much lucky grateful smartassfamily  love
0.001709559960990978,  Whaaaat Oh hell no I was jealous because you got paid to fuck but this is a whole new level anger love conflicted  _emoj_grimacing_ 
0.0017091957595618225, ehhh I guess I want to everyone I've ever burst out laughing in front of  _emoj_joy_ 
0.0017085750569913703, Happy birthday Hope you have a wonderful day filled with lots of joy and laughter lt3 despite tumblr being a jerk once again
0.0017083511718732408,It's an exhilarating feeling Working hard and feeling accomplished whether they notice or not you feel fuking good   _emoj_money_mouth_face_
0.001707371458574682,  Whaaaat Oh hell no I was jealous because you got paid to fuck but this is a whole new level  love conflicted  _emoj_grimacing_ 
0.0017064928510194513,Being happy means letting go of the clinging and attachment to things in your life WednesdayWisdom life
0.0017062010729208287,survivor is back SurvivorMillennialsVsGenX so happy to see you  happy
0.0017042780499603018,You are so cool I feel slightly intimidated sometimes but YOU ARE A VERY NICE PERSON and I LIKE THE THINGS YOU DO   _emoj_heart__emoj_heart_ 
0.0017035950511006955, aww thank you I'm definitely feeling much better today and your messages cheer me up too   _emoj_white_smiling_face_  ufe0f
0.0016979377842746655,I really love the customer service  they're always so nice helpful and cheerful 
0.001697825279297801, happppy happppyyyyyy happppppyyyyy haaapppyyyy birthday best friend Love you lots   _emoj_heart_   _emoj_heart_   _emoj_heart_   _emoj_heart_   _emoj_heart_   _emoj_heart_   _emoj_heart_   _emoj_tada_   _emoj_confetti_ball_  chapter22 bdaygirl  love
0.0016973870865075009,Transitioning to a new job is hard when you have nothing but joyful memories of the previous one Thanks  for changing my life   _emoj_heart_  ufe0f
0.0016973139859545424,Retweeted GunnySmith93   Days like today I am happy to be alive blessed rejoice
0.001697268147249358, yes  make her smile and be happy she deserves happiness
0.0016968579890601636,Great to meet   tonight What a lively and enthusiastic bunch Look forward to working with you again
0.0016955163895199293,This night is sparkling don't you let it go I'm wonder struck Blushing on the way home'
0.0016950138881091678, babe  remember I'm ALWAYS here if u need a little cheering up or talk ily lots  _emoj_cupid_ 
0.0016940731159874936,What a great training course lots of photos fun and laughter Photo's will be up soon Boostercourse fun 
0.0016939498193405944,I just want to let everyone out there know you are wonderful people beyourself   latenight compliment behappy
0.0016932715894131189, awe I miss your sweet smile Come visit me and  sometime when we're not all working  _emoj_sweat_smile_   _emoj_weary_ 
0.001692987785963136,A smile brightens your day and the day of everyone around you so remember to smile it's free 
0.001692401853517587,Love the new song I can't stop thinking about you by 
0.0016897881143126381,I WANNA GET UP AND DANCE but everyone is in bed this sucks Everyone wake up   _emoj_hushed_  hyper happy letsdance dirtydancinginthemoonlight  _emoj_ok_hand_ 
0.0016897063054083258,Omg You've got to watch the new series 'This is Us'wow Best tv show I've seen in a long time  tears  moretears
0.0016894277455692399,BridgetJonesBaby is the best thing I've seen in ages So funny I've missed Bridget love hilarious TeamMark
0.001688719670815231,   I still can't get jimmy garoppolo out of my head and it's been almost weeks Thanks a lot 
0.0016882065351731255,AskAMan but this does not sound like a serious issue cause siyahleka the whole time just having fun
0.0016872788990507205,i mean i guess most of the mean ones are treated as like playful but i want to support yoosung without dating him ___
0.00168716290801108,  Katie I love how you describe yourself as 'normal' Really you're anything but hilarious neverchange
0.0016869003022875345,Watching  in Spy she's one of Favorite actresses Last night I was watching her theboss hilarious I just want to meet her
0.001684739070182283,Happy 69th  May u keep haunting us for many years horror writing
0.0016830547484400393,By the way I'm wearing the smile you gave me today   you me 
0.0016830120840926484,today has been terrible but tonight will end better because I get to see Malik   _emoj_heart_  ufe0f
0.0016829571320487802,Hi Luke hemmings    _emoj_bouquet_   _emoj_cherry_blossom_   _emoj_bouquet_   If I had a flower for every time you made me smile I'd have a garden Please follow me     _emoj_bouquet_   _emoj_cherry_blossom_   _emoj_bouquet_  I love you x16092
0.0016808539118015559, what a happy looking couple 
0.0016802183877984293,Go follow me on Musically  I am making a lively Come and join BFFing and Following  See you there
0.0016800150654455847,When you wake up from a dream laughing at something stupid and that makes you laugh more 
0.0016794420823135214,This is the day You've made   Let us rehoi rejoice and be glad with all that I am     _emoj_blush_   _emoj_heart_   aja  Good morning
0.0016793605603026077, happy birthday  have a blessed day love from Toronto  bday smile
0.0016784270825543068,I'm always smiling so that's why I'm always happy   _emoj_joy_ 
0.0016781853012750832,I love my mother but talking about the recent horrific murders with her is exhausting Is this really how America feels
0.0016773032970338862,I love how cheery and adoring  gets every time he produces new content
0.0016771089593744628,i made a squirrel friend today i gave him the core of the plum i was eating he seemed very happy
0.0016768401401467993, awe thank you so much love   _emoj_heart__emoj_heart_ 
0.0016754097569161245,Did u laugh today Laugh hard I hope sowe NEED laughter now smile love
0.0016747190291153556,Happy 69th  May u keep haunting us for many years  writing
0.0016739897917536007, Thanks for the follow Hope you're having a terrific day
0.0016728620929634943, he's perfect But not even in that way where you sort of resent him or suspect that he leads a double life Just perfect
0.0016727786527754396,Does anyone remember a movie that is animated in the late 70's called Shame of the Jungle John Bulushi was in it wild if that's your taste
0.0016724462062433212,   It's always fun to anger 'All the Old Dudes' with Rock N' Roll 
0.0016724194442182083,  On PHP54  and though the Kardashian stuff goes over my head you're both hilarious like gleeful little boys   _emoj_joy_   _emoj_joy_ 
0.0016721589248683256,May your day be filled with peacelove n laughter Have a very nice day full of Success Jummah Mubarak  _emoj_innocent_   good morning  _emoj_hot_beverage_  
0.0016708983469821204,Happy birthday  keep smiling alwaysWishing you a wonderful year ahead mam
0.0016708285353026267,  you're welcome It's genuinely made me give my head a wobble and realise what's important in life  smiling
0.0016708024190261067, My first time watching your vids and i died of laughter Keep this up dude
0.0016706460090863463, You've got quite the cheery young Souls fan 
0.0016701991408581242,Indian time it's already ur birthday  Have a stupendous birthday Wish you more success laughter and lots of love Hugs x
0.0016696404460387914,LOVE LOVE LOVE smile fun relaxationiskey
0.0016695029502898156,Did u laugh today Laugh hard I hope sowe NEED laughter now  love
0.0016683383655685348,All i want to do is to be successful be cheerful and to be happy with 
0.0016682539892708887,Good morning Welcome the new day into your life and your heart mindfulness smile zen
0.0016682252148154022,I'm so so so excited for UsernameRegenerated  I can't wait I wish I could get a signed copy I'm so happy for you 
0.0016675881602344464,There is something v satisfying about  opening an old 'to do'doc file and being able to check off all the things you have done 
0.0016674918945428813,Whatever you decide to do make sure it makes you happy
0.0016642336160496592,At the point today where if someone says something remotely kind to me a waterfall will burst out of my eyes
0.0016640643108208747,Do what makes you successful and happy now and forever
0.001663870235273768,However the agent was inauthentic my sister still loves me I'm still alive So I guess it wasn't that bad socialanxiety anxiety
0.0016633556993615622,   Always so happy to support you brother Keep that fire burning lt3
0.0016633411528526629,Every time I hear 's organ kick in on the new  I break into the goofiest smile
0.0016625802910236083,Trying to loveee somebody just wanna love somebody right now guess there's just no pleasing me
0.0016624328968632023,  Thank you for saying what others are afraid to say Carl Big fan
0.0016606706032638726,And by the way Takeru's eyes sparkling while eating was like the cutest thing ever
0.0016558140354224066,I just really enjoy bright colors like the colors you would see downtown Miami
0.001653610956595378, Thank you for the follow Looking forward to your tweets as they look entertaining smile socialmedia
0.001653192683663439,Like I said   _emoj_black_rightward_arrow_  there's plenty of cheddar in the cheese to go around For everyone   _emoj_white_smiling_face_  smile
0.0016525699442095929,Love takes off the masks that we fear we cannot live without and know we cannot live within  James A Baldwin
0.0016523321326414094,This night is sparkling don't you let it go I'm wonderstruck blushing all the way home' ValerieBot
0.0016503139241383065, Happy birthday sweety  sweet hun hope u have a wonderful day and a wondrful joyful year better than the last one Luv U   _emoj_heart_ 
0.0016478030221530058, The guy who calls people 'cuck' and is antiBLM is offended by idea that he might not be propolicing reform That's amazing
0.0016465576123720037,I am always ready to smile
0.001645489986663238,Love the new song I can't stop thinking about you by sting
0.0016453397369029785,Not untill today has anyone ever said to me they remember what I had on over years ago when they met me n liked me since cutealert happy
0.0016448463633676514,In honor of Shawty Lo passing away I made Dey Know my new alarm clock song so I wake up with the right attitude everyday lol
0.0016439966542423888,I took a yr off school and I'm proud to say I got accepted again yo girl is going to finish 
0.0016430453149990157,Good morning chirpy SpringEquinox and your pensive sister AutumnEquinox A perfect day however it is expressed   _emoj_rose_   _emoj_maple_leaf_   _emoj_first_quarter_moon_   _emoj_yin_yang_  ufe0f theBeautyofBalance
0.001642924963635999,It's meant to be happy happy
0.0016427948497494205, happy birthday to the most beautiful cheerful sister ever llnp   _emoj_heart__emoj_heart_   _emoj_heavy_heart_exclamation_mark_ornament_   _emoj_tada_ 
0.0016410241355311924, Thank you for the most fantastic evening it was a brilliant show you are a truly sparkling talent night over too quickly
0.001640931280169618, We love you hilarious   We are looking forward to SO much more  kudos on the pilot  speechless
0.0016404761639972033,Appreciate what you have enjoy your life  Use your smile   _emoj_smiley_  to help others use theirs   _emoj_white_smiling_face_  ufe0f
0.0016387261920920856,   other begin telling a 'story' he realized that she was making an attempt at cheering him up It was sweet of her and so   _emoj_black_rightward_arrowhead_ 
0.0016377463267057259,  _emoj_fire_   _emoj_information_desk_person_   _emoj_fitzpatrick_type_3  its lit having a class with you Your such a great person and good at cheer
0.0016377463267057257, uf525 uf481 uf3fc its lit having a class with you Your such a great person and good at cheer
0.0016364158778052612,The majority of my clients have family partner day job life AND write their beautiful books awe gratitude HARDwork
0.001633995011904905,And the weather so breezy man why can't life always be this easy
0.0016328934306311512,I'm watching joyful noise for time cuz I love this movie and 
0.0016322924030962363,Don't let worry get you down  Remember that Moses started out as a basket case  lol  Today choose faith over  Moses
0.001631690254187171, 'Pleased to meet you You obviously know me' offers her hand to shake
0.0016306367149717912,Tutoring gives me such an exhilarating feeling I love helping people   _emoj_relieved_ 
0.00163052048984276,By the way I'm wearing the smile you gave me today  you me smile
0.0016272414608803794,You know what's great about GBBO  Contestants helping each other cheering each other on So important
0.0016261306400317944,  watching the jubilant scrum at the end of the day and remembering they're all still kids priceless
0.0016259822765802732,second day on the job and i already got a dollar tip from a dude whose was constantly twitching his eye LOLOLOL cheering
0.0016250419627303586,What I would give To feel the sunlight on my face What I would give To be lost in your embrace   _emoj_headphones_   Fallen
0.001624234560522204, happy birthday  have a blessed day love from Toronto  bday 
0.0016232374831139597, Thank you happy birthday to you as well
0.0016230448975186169,happiness recipe an open mind laughter a kind heart 
0.001622929718673474,I love looking at my old statuses on Facebook The one I have from four years ago on this day was about glee I had so many opinions
0.0016203610054334949,Go one extra mile just see her smiling
0.0016199137675527832,no offense but the doctor crying tears of joy after realizing he has a family for christmas is Cute
0.0016184524844770972,I am a simple human being who just really loves  like truly madly deeply rejoicing in her existence class and queendom
0.001618245772005428,  _emoj_fallen_leaf_   _emoj_musical_note_  _emoj_black_sun_with_rays_  fall sounds great  dream blues rock by  Get the top album  'One Love'  by hero  D
0.0016178627231867781, With or without cake seeing your wee cheery face is always a joy xx
